,Symbol,Name,IndustryCode,Industry
1693,8596,Kyushu Leasing Service Co Ltd,55101050,기업 금융 서비스
1694,6125,Okamoto Machine Tool Works Ltd,52102010,산업용 기계 및 장비
1695,3488,Xymax Reit Investment Corp,60102010,복합부동산 REITs
1696,2153,E J Holdings Inc,52201020,건설 및 엔지니어링
1697,4448,kubell Co Ltd,57201020,소프트웨어
1698,2533,Oenon Holdings Inc,54101020,증류주 및 포도주
1699,2471,S-Pool Inc,52203030,고용 서비스
1700,1904,Taisei Oncho Co Ltd,52201020,건설 및 엔지니어링
1701,6137,Koike Sanso Kogyo Co Ltd,52102010,산업용 기계 및 장비
1702,9556,Intloop Inc,52203040,경영 지원 서비스
1703,212A,Fit Easy Inc,53301040,여가 및 오락시설
1704,4072,Densan System Holdings Co Ltd,57201010,IT 서비스 및 컨설팅
1705,5541,Pacific Metals Co Ltd,51201050,특수 채굴 및 금속
1706,2114,Fuji Nihon Corp,54102020,식품 가공
1707,7305,Araya Industrial Co Ltd,51201020,철 및 강철
1708,7962,King Jim Co Ltd,52203060,비즈니스 지원 용품
1709,7229,Yutaka Giken Co Ltd,53101020,"자동차, 트럭 및 오토바이 부품"
1710,7637,Hakudo Co Ltd,51201030,알루미늄
1711,8301,Bank of Japan,55101010,은행
1712,7971,Toli Corp,53203020,건설 자재 및 비품
1713,4659,AJIS Co Ltd,52203040,경영 지원 서비스
1714,3921,Neojapan Inc,57201020,소프트웨어
1715,8844,Cosmos Initia Co Ltd,60101010,"부동산 임대, 개발 및 운영"
1716,2301,Gakujo Co Ltd,52203030,고용 서비스
1717,8018,Sankyo Seiko Co Ltd,53202020,의류 및 액세서리
1718,7628,Ohashi Technica Inc,53101020,"자동차, 트럭 및 오토바이 부품"
1719,8101,GSI Creos Corp,53202010,직물 및 가죽제품
1720,9600,I-Net Corp,57201010,IT 서비스 및 컨설팅
1721,9788,Nac Co Ltd,53203010,주택 건설
1722,7480,Suzuden Corp,52102030,전기 부품 및 장비
1723,9287,Japan Infrastructure Fund Investment Corp,55501030,폐쇄형 펀드
1724,2498,Oriental Consultants Holdings Co Ltd,52201020,건설 및 엔지니어링
1725,1866,Kitano Construction Corp,52201020,건설 및 엔지니어링
1726,7185,Hirose Tusyo Inc,55102010,투자 은행 및 중개 서비스
1727,7955,Cleanup Corp,53203020,건설 자재 및 비품
1728,1909,Nippon Dry-Chemical Co Ltd,53203020,건설 자재 및 비품
1729,8158,Soda Nikka Co Ltd,51101010,상품 화학
1730,8203,Mr Max Holdings Ltd,53402020,할인점
1731,1810,Matsui Construction Co Ltd,52201020,건설 및 엔지니어링
1732,6584,Sanoh Industrial Co Ltd,53101020,"자동차, 트럭 및 오토바이 부품"
1733,9332,Nisso Holdings Co Ltd,52203030,고용 서비스
1734,6539,Matching Service Japan Co Ltd,52203030,고용 서비스
1735,7683,WA Inc,53202030,제화
1736,6627,Tera Probe Inc,57101020,반도체 장비 및 테스트
1737,7638,New Art Holdings Co Ltd,53202020,의류 및 액세서리
1738,6357,Sansei Technologies Inc,52102010,산업용 기계 및 장비
1739,7803,Bushiroad Inc,53302030,엔터테인먼트 제작
1740,3452,B-Lot Co Ltd,60101010,"부동산 임대, 개발 및 운영"
1741,2820,Yamami Co,54102020,식품 가공
1742,6330,Toyo Engineering Corp,52201020,건설 및 엔지니어링
1743,7092,Fast Fitness Japan Inc,53301040,여가 및 오락시설
1744,7952,Kawai Musical Instruments Manufacturing Co Ltd,53205020,오락용 제품
1745,6071,IBJ Inc,54201030,개인 서비스
1746,3205,Daidoh Ltd,53202020,의류 및 액세서리
1747,8103,Meiwa Corp,51101010,상품 화학
1748,9535,Hiroshima Gas Co Ltd,59102010,천연가스 유틸리티
1749,1811,Zenitaka Corp,52201020,건설 및 엔지니어링
1750,2674,Hard Off Corporation Co Ltd,53403090,기타 전문 소매
1751,9405,Asahi Broadcasting Group Holdings Corp,53302020,방송
1752,6331,Mitsubishi Kakoki Kaisha Ltd,52102010,산업용 기계 및 장비
1753,6785,Suzuki Co Ltd,52102030,전기 부품 및 장비
1754,4301,Amuse Inc,53302030,엔터테인먼트 제작
1755,8713,Fidea Holdings Co Ltd,55101010,은행
1756,9658,Business Brain Showa-Ota Inc,57201010,IT 서비스 및 컨설팅
1757,5038,eWeLL Co Ltd,57201020,소프트웨어
1758,6855,Japan Electronic Materials Corp,57101020,반도체 장비 및 테스트
1759,4955,Agro-Kanesho Co Ltd,51101020,농화학제
1760,3475,Good Com Asset Co Ltd,60101010,"부동산 임대, 개발 및 운영"
1761,9115,Meiji Shipping Group Co Ltd,52405020,해양 화물 및 물류
1762,6844,Shindengen Electric Manufacturing Co Ltd,52102030,전기 부품 및 장비
1763,4671,Falco Holdings Co Ltd,56102010,의료 시설 및 서비스
1764,9273,Koa Shoji Holdings Co Ltd,56201040,제약
1765,3914,Jig-Saw Inc,57201010,IT 서비스 및 컨설팅
1766,6997,Nippon Chemi-Con Corp,52102030,전기 부품 및 장비
1767,2933,Kibun Foods Inc,54102020,식품 가공
1768,3900,CrowdWorks Inc,52203030,고용 서비스
1769,4538,Fuso Pharmaceutical Industries Ltd,56201040,제약
1770,9628,San Holdings Inc,54201030,개인 서비스
1771,2804,Bull-Dog Sauce Co Ltd,54102020,식품 가공
1772,4972,Soken Chemical & Engineering Co Ltd,51101030,특수 화학제
1773,4229,Gun Ei Chemical Industry Co Ltd,51101030,특수 화학제
1774,3696,Ceres Inc,57201030,온라인 서비스
1775,7500,Nishikawa Keisoku Co Ltd,52102030,전기 부품 및 장비
1776,4053,Sun* Inc,57201010,IT 서비스 및 컨설팅
1777,7570,Hashimoto Sogyo Holdings Co Ltd,53203020,건설 자재 및 비품
1778,9955,Yonkyu Co Ltd,54102010,어업 및 농업
1779,8551,Kita-Nippon Bank Ltd,55101010,은행
1780,9850,Gourmet Kineya Co Ltd,53301020,레스토랑 및 바
1781,7373,Aidma Holdings Inc,52203040,경영 지원 서비스
1782,1780,Yamaura Corp,52201020,건설 및 엔지니어링
1783,6832,Aoi Electronics Co Ltd,57101010,반도체
1784,9386,Nippon Concept Corp,52405020,해양 화물 및 물류
1785,2158,FRONTEO Inc,57201010,IT 서비스 및 컨설팅
1786,7475,Albis Co Ltd,54301020,식품 소매 및 유통
1787,6489,Maezawa Industries Inc,52102010,산업용 기계 및 장비
1788,3915,TerraSky Co Ltd,57201010,IT 서비스 및 컨설팅
1789,8139,Nagahori Corp,53202020,의류 및 액세서리
1790,3073,DD Group Co Ltd,53301020,레스토랑 및 바
1791,3178,Chimney Co Ltd,53301020,레스토랑 및 바
1792,3771,System Research Co Ltd,57201010,IT 서비스 및 컨설팅
1793,9906,Fujii Sangyo Corp,52102030,전기 부품 및 장비
1794,7047,Port Inc,57201030,온라인 서비스
1795,2882,Eat&Holdings Co Ltd,54102020,식품 가공
1796,8772,Asax Co Ltd,55101050,기업 금융 서비스
1797,7779,Cyberdyne Inc,56102010,의료 시설 및 서비스
1798,3939,Kanamic Network Co Ltd,57201010,IT 서비스 및 컨설팅
1799,3040,Soliton Systems KK,57201030,온라인 서비스
1800,4377,One Career Inc,57201030,온라인 서비스
1801,3825,Remixpoint Inc,59101010,전력 유틸리티
1802,8920,Tosho Co Ltd,53301040,여가 및 오락시설
1803,4771,F&M Co Ltd,52203040,경영 지원 서비스
1804,7525,RIX Corp,52102010,산업용 기계 및 장비
1805,7520,Eco's Co Ltd,54301020,식품 소매 및 유통
1806,6387,Samco Inc,57101020,반도체 장비 및 테스트
1807,2936,BASE FOOD Inc,54102020,식품 가공
1808,6547,Greens Co Ltd,53301010,"호텔, 모텔 및 크루즈 라인"
1809,8881,Nisshin Group Holdings Co Ltd,60101010,"부동산 임대, 개발 및 운영"
1810,3449,Technoflex Corp,53203020,건설 자재 및 비품
1811,5957,Nitto Seiko Co Ltd,52102010,산업용 기계 및 장비
1812,6482,Yushin Precision Equipment Co Ltd,52102010,산업용 기계 및 장비
1813,7326,SBI Insurance Group Co Ltd,55301010,복합보험 및 중개인
1814,3763,Pro-Ship Inc,57201020,소프트웨어
1815,4968,Arakawa Chemical Industries Ltd,51101010,상품 화학
1816,3179,Syuppin Co Ltd,53403050,컴퓨터 및 전자 제품 소매
1817,5902,Hokkan Holdings Ltd,51302010,용기(종이 제외) 및 포장재
1818,3393,Startia Holdings Inc,57201010,IT 서비스 및 컨설팅
1819,8558,Towa Bank Ltd,55101010,은행
1820,5017,Fuji Oil Co Ltd,50102030,"오일, 가스 정제 및 마케팅"
1821,9424,Japan Communications Inc,57401020,무선 통신 서비스
1822,9687,KSK Co Ltd,57201010,IT 서비스 및 컨설팅
1823,8869,Meiwa Estate Co Ltd,60101010,"부동산 임대, 개발 및 운영"
1824,4979,OAT Agrio Co Ltd,51101020,농화학제
1825,6697,Techpoint Inc DRC,57101010,반도체
1826,7236,T.RAD Co Ltd,53101020,"자동차, 트럭 및 오토바이 부품"
1827,3075,Choushimaru Co Ltd,53301020,레스토랑 및 바
1828,8928,Anabuki Kosan Inc,60101010,"부동산 임대, 개발 및 운영"
1829,2975,Star Mica Holdings Co Ltd,60101010,"부동산 임대, 개발 및 운영"
1830,5932,Sankyo Tateyama Inc,53203020,건설 자재 및 비품
1831,6779,Nihon Dempa Kogyo Co Ltd,57104010,전자 장비 및 부품
1832,4748,Kozo Keikaku Engineering Inc,57201020,소프트웨어
1833,7187,J-Lease Co Ltd,55101030,소비자 대출
1834,4410,Harima Chemicals Group Inc,51101010,상품 화학
1835,7245,Daido Metal Co Ltd,53101020,"자동차, 트럭 및 오토바이 부품"
1836,2830,Aohata Corp,54102020,식품 가공
1837,6191,AirTrip Corp,53301040,여가 및 오락시설
1838,208A,Kozo Keikaku Engineering Holdings Inc,57201020,소프트웨어
1839,7554,Kourakuen Corp,53301020,레스토랑 및 바
1840,4880,CellSource Co Ltd,56102010,의료 시설 및 서비스
1841,3276,Japan Property Management Center Co Ltd,60101010,"부동산 임대, 개발 및 운영"
1842,9216,Bewith Inc,52203040,경영 지원 서비스
1843,4599,StemRIM Inc,56201040,제약
1844,6310,Iseki&Co Ltd,52102020,중장비 및 차량
1845,3891,Nippon Kodoshi Corp,57104010,전자 장비 및 부품
1846,8038,Tohto Suisan Co Ltd,54102010,어업 및 농업
1847,6089,Will Group Inc,52203030,고용 서비스
1848,250A,Shimadaya Corp,54102020,식품 가공
1849,6677,SK-Electronics Co Ltd,57101010,반도체
1850,7717,V Technology Co Ltd,57104010,전자 장비 및 부품
1851,2198,IKK Holdings Inc,54201030,개인 서비스
1852,7814,Japan Creative Platform Group Co Ltd,52203020,상업 인쇄 서비스
1853,3655,BrainPad Inc,57201010,IT 서비스 및 컨설팅
1854,1964,Chugai Ro Co Ltd,52102010,산업용 기계 및 장비
1855,6050,E-Guardian Inc,52203040,경영 지원 서비스
1856,6464,Tsubaki Nakashima Co Ltd,52102010,산업용 기계 및 장비
1857,4022,Rasa Industries Ltd,51101010,상품 화학
1858,2998,Creal Inc,60101020,부동산 서비스
1859,4435,Kaonavi Inc,57201020,소프트웨어
1860,6562,Geniee Inc,53302010,광고 및 마케팅
1861,2120,LIFULL Co Ltd,57201030,온라인 서비스
1862,3793,Drecom Co Ltd,57201020,소프트웨어
1863,5142,Achilles Corp,51101010,상품 화학
1864,9979,Daisyo Corp,53301020,레스토랑 및 바
1865,9233,Asia Air Survey Co Ltd,51201070,채굴 지원 서비스 및 장비
1866,6927,Helios Techno Holding Co Ltd,52102030,전기 부품 및 장비
1867,3171,Maxvalu Kyushu Co Ltd,54301020,식품 소매 및 유통
1868,5535,Migalo Holdings Inc,60101020,부동산 서비스
1869,6879,Imagica Group Inc,53302030,엔터테인먼트 제작
1870,7820,Nihon Flush Co Ltd,53203020,건설 자재 및 비품
1871,4745,Tokyo Individualized Educational Institute Inc,63101010,기타 교육 서비스 제공
1872,5574,ABEJA Inc,57201010,IT 서비스 및 컨설팅
1873,5135,AIR-U Ltd,57401020,무선 통신 서비스
1874,6358,Sakai Heavy Industries Ltd,52102020,중장비 및 차량
1875,3649,Findex Inc,56101010,첨단 의료 장비 및 기술
1876,3925,Double Standard Inc,52203040,경영 지원 서비스
1877,4092,Nippon Chemical Industrial Co Ltd,51101010,상품 화학
1878,2378,Renaissance Inc,53301040,여가 및 오락시설
1879,3864,Mitsubishi Paper Mills Ltd,51301020,종이 제품
1880,9908,Nihon Denkei Co Ltd,52102010,산업용 기계 및 장비
1881,2930,Kitanotatsujin Corp,53402010,백화점
1882,3741,Systems Engineering Consultants Co Ltd,57201020,소프트웨어
1883,9769,Gakkyusha Co Ltd,63101010,기타 교육 서비스 제공
1884,2389,Digital Holdings Inc,53302010,광고 및 마케팅
1885,7466,SPK Corp,53101020,"자동차, 트럭 및 오토바이 부품"
1886,5834,SBI Leasing Services Co Ltd,55101050,기업 금융 서비스
1887,7856,Hagihara Industries Inc,51101010,상품 화학
1888,9083,Shinki Bus Co Ltd,52406020,지상 및 해상 여객 운송
1889,6246,Techno Smart Corp,52102010,산업용 기계 및 장비
1890,3922,PR Times Corp,57201030,온라인 서비스
1891,4080,Tanaka Chemical Corp,51101010,상품 화학
1892,3558,Jade Group Inc,57201030,온라인 서비스
1893,5632,Mitsubishi Steel Mfg. Co Ltd,51201020,철 및 강철
1894,6918,Aval Data Corp,57101020,반도체 장비 및 테스트
1895,7678,Asakuma Co Ltd,53301020,레스토랑 및 바
1896,3926,Open Door Inc,57201030,온라인 서비스
1897,9644,Tanabe Consulting Group Co Ltd,52203040,경영 지원 서비스
1898,6293,Nissei Plastic Industrial Co Ltd,52102010,산업용 기계 및 장비
1899,7621,Ukai Co Ltd,53301020,레스토랑 및 바
1900,3010,Polaris Holdings Co Ltd,53301010,"호텔, 모텔 및 크루즈 라인"
1901,2477,Temairazu Inc,57201030,온라인 서비스
1902,8093,Kyokuto Boeki Kaisha Ltd,52102010,산업용 기계 및 장비
1903,6073,Asante Inc,52201020,건설 및 엔지니어링
1904,3773,Advanced Media Inc,57201020,소프트웨어
1905,4973,Japan Pure Chemical Co Ltd,51101030,특수 화학제
1906,4393,Bank of Innovation Inc,57201020,소프트웨어
1907,8070,Tokyo Sangyo Co Ltd,52102010,산업용 기계 및 장비
1908,6932,Endo Lighting Corp,53203020,건설 자재 및 비품
1909,8095,Astena Holdings Co Ltd,56201040,제약
1910,6184,Kamakura Shinsho Ltd,57201030,온라인 서비스
1911,6264,Marumae Co Ltd,57104010,전자 장비 및 부품
1912,8007,Takashima & Co Ltd,53203020,건설 자재 및 비품
1913,3834,Asahi Net Inc,57401010,통합 통신 서비스
1914,6850,Chino Corp,52102030,전기 부품 및 장비
1915,5945,Tenryu Saw Mfg Co Ltd,52102010,산업용 기계 및 장비
1916,9845,Parker Corp,51101010,상품 화학
1917,4371,Core Concept Technologies Inc,57201010,IT 서비스 및 컨설팅
1918,6298,YAC Holdings Co Ltd,57101020,반도체 장비 및 테스트
1919,9450,Fibergate Inc,57401020,무선 통신 서비스
1920,9467,AlphaPolis Co Ltd,53302040,소비자 출판
1921,6405,Suzumo Machinery Co Ltd,52102010,산업용 기계 및 장비
1922,2185,CMC Corp,53302010,광고 및 마케팅
1923,3968,Segue Group Co Ltd,57201010,IT 서비스 및 컨설팅
1924,6378,Kimura Chemical Plants Co Ltd,52102010,산업용 기계 및 장비
1925,4058,Toyokumo Inc,57201010,IT 서비스 및 컨설팅
1926,5981,Tokyo Rope Mfg Co Ltd,51201020,철 및 강철
1927,5015,BP Castrol KK,50102030,"오일, 가스 정제 및 마케팅"
1928,9163,Nareru Group Inc,52203030,고용 서비스
1929,5933,Alinco Inc,53203020,건설 자재 및 비품
1930,6955,FDK Corp,52102030,전기 부품 및 장비
1931,2445,Takamiya Co Ltd,52203040,경영 지원 서비스
1932,7691,C Channel Corp,53402010,백화점
1933,7774,Japan Tissue Engineering Co Ltd,56101020,"의료 장비, 물품 및 유통"
1934,3457,&Do Holdings Co Ltd,60101020,부동산 서비스
1935,2163,Artner Co Ltd,52203030,고용 서비스
1936,6626,Semitec Corp,57104010,전자 장비 및 부품
1937,9612,Luckland Co Ltd,52201020,건설 및 엔지니어링
1938,3951,Asahi Printing Co Ltd,51302020,종이 포장재
1939,6231,Kimura Kohki Co Ltd,52102030,전기 부품 및 장비
1940,1712,Daiseki Eco Solution Co Ltd,52203010,환경 서비스 및 장비
1941,9033,Hiroshima Electric Railway Co Ltd,52406020,지상 및 해상 여객 운송
1942,4463,Nicca Chemical Co Ltd,51101030,특수 화학제
1943,2338,Quantum Solutions Co Ltd,57201010,IT 서비스 및 컨설팅
1944,8285,Mitani Sangyo Co Ltd,52202010,다각적 산업용 제품 도매
1945,8029,Look Holdings Inc,53202020,의류 및 액세서리
1946,6382,Trinity Industrial Corp,52102010,산업용 기계 및 장비
1947,5269,Nippon Concrete Industries Co Ltd,51202010,건설 자재
1948,3068,WDI Corp,53301020,레스토랑 및 바
1949,3678,Media Do Co Ltd,53302040,소비자 출판
1950,6986,Futaba Corp,52102030,전기 부품 및 장비
1951,2418,Tsukada Global Holdings Inc,54201030,개인 서비스
1952,1827,Nakano Corp,52201020,건설 및 엔지니어링
1953,3486,Global Link Management Inc,60101010,"부동산 임대, 개발 및 운영"
1954,4668,Meiko Network Japan Co Ltd,63101010,기타 교육 서비스 제공
1955,202A,Mamezo Digital Holdings Co Ltd,57201010,IT 서비스 및 컨설팅
1956,5074,Tess Holdings Co Ltd,59101010,전력 유틸리티
1957,4251,Keiwa Inc,51101010,상품 화학
1958,8338,Tsukuba Bank Ltd,55101010,은행
1959,135A,Vrain Solution Inc,57201010,IT 서비스 및 컨설팅
1960,6962,Daishinku Corp,57104010,전자 장비 및 부품
1961,6255,NPC Inc,52102010,산업용 기계 및 장비
1962,9880,Innotech Corp,57201010,IT 서비스 및 컨설팅
1963,3877,Chuetsu Pulp & Paper Co Ltd,51301020,종이 제품
1964,5363,TYK Corp,51202010,건설 자재
1965,8089,Nice Corp,53203020,건설 자재 및 비품
1966,1736,Otec Corp,53203020,건설 자재 및 비품
1967,6706,DKK Co Ltd,57102010,통신 및 네트워킹
1968,3772,Wealth Management Inc,60101010,"부동산 임대, 개발 및 운영"
1969,2204,Nakamuraya Co Ltd,54102020,식품 가공
1970,6445,Janome Corp,53204030,"가전제품, 도구 및 가정 용품"
1971,3676,Digital Hearts Holdings Co Ltd,57201010,IT 서비스 및 컨설팅
1972,7320,Solvvy Inc,54201030,개인 서비스
1973,2806,Yutaka Foods Corp,54102020,식품 가공
1974,3611,Matsuoka Corp,53202020,의류 및 액세서리
1975,4588,Oncolys Biopharma Inc,56201040,제약
1976,6199,Seraku Co Ltd,57201010,IT 서비스 및 컨설팅
1977,260A,Alt Inc,57201010,IT 서비스 및 컨설팅
1978,6061,Universal Engeisha Co Ltd,53403020,주택 개조 제품 및 서비스 소매
1979,3905,Datasection Inc,57201020,소프트웨어
1980,3989,Sharingtechnology Inc,57201030,온라인 서비스
1981,9913,Nippo Ltd,57104010,전자 장비 및 부품
1982,6157,NS Tool Co Ltd,52102010,산업용 기계 및 장비
1983,7888,Sanko Gosei Ltd,52102010,산업용 기계 및 장비
1984,3180,Beauty Garage Inc,53403090,기타 전문 소매
1985,1828,Tanabe Engineering Corp,52201020,건설 및 엔지니어링
1986,4498,Cybertrust Japan Co Ltd,57201020,소프트웨어
1987,4011,Headwaters Co Ltd,57201010,IT 서비스 및 컨설팅
1988,4434,Serverworks Co Ltd,57201010,IT 서비스 및 컨설팅
1989,2307,Cross Cat Co Ltd,57201010,IT 서비스 및 컨설팅
1990,3837,Ad-Sol Nissin Corp,57201010,IT 서비스 및 컨설팅
1991,6194,Atrae Inc,57201030,온라인 서비스
1992,1847,Ichiken Co Ltd,52201020,건설 및 엔지니어링
1993,4396,System Support Inc,57201010,IT 서비스 및 컨설팅
1994,9046,Kobe Electric Railway Co Ltd,52406020,지상 및 해상 여객 운송
1995,4783,NCD Co Ltd,57201010,IT 서비스 및 컨설팅
1996,7481,Oie Sangyo Co Ltd,54301020,식품 소매 및 유통
1997,4054,Japan PropTech Co Ltd,57201020,소프트웨어
1998,6566,Kaname Kogyo Co Ltd,52203010,환경 서비스 및 장비
1999,3947,Dynapac Co Ltd,51302020,종이 포장재
2000,6619,W-Scope Corp,52102030,전기 부품 및 장비
2001,8202,Laox Holdings Co Ltd,53403090,기타 전문 소매
2002,9057,Enshu Truck Co Ltd,52405030,지상 화물 및 물류
2003,165A,SBI Rheos Hifumi Inc,55102020,투자 관리 및 펀드 운영
2004,5210,Nihon Yamamura Glass Co Ltd,51302010,용기(종이 제외) 및 포장재
2005,4574,Taiko Pharmaceutical Co Ltd,56201040,제약
2006,5132,pluszero Inc,57201010,IT 서비스 및 컨설팅
2007,8076,Canox Corp,51201020,철 및 강철
2008,2814,Sato Foods Industries Co Ltd,54102020,식품 가공
2009,9768,Idea Consultants Inc,52203010,환경 서비스 및 장비
2010,8118,King Co Ltd,53202020,의류 및 액세서리
2011,4809,Paraca Inc,52407030,고속도로 및 철도
2012,9059,Kanda Holdings Co Ltd,52405030,지상 화물 및 물류
2013,6365,DMW Corp,52102010,산업용 기계 및 장비
2014,1814,Daisue Construction Co Ltd,52201020,건설 및 엔지니어링
2015,8006,Yuasa Funashoku Co Ltd,54301020,식품 소매 및 유통
2016,2374,Saint-Care Holding Corp,56102010,의료 시설 및 서비스
2017,2193,Cookpad Inc,57201030,온라인 서비스
2018,3388,Meiji Electric Industries Co Ltd,52102030,전기 부품 및 장비
2019,6470,Taiho Kogyo Co Ltd,53101020,"자동차, 트럭 및 오토바이 부품"
2020,2428,Wellnet Corp,52203040,경영 지원 서비스
2021,3166,Ochi Holdings Co Ltd,53203020,건설 자재 및 비품
2022,4994,Taisei Lamick Co Ltd,51302010,용기(종이 제외) 및 포장재
2023,2009,Torigoe Co Ltd,54102020,식품 가공
2024,9696,With us Corp,63101010,기타 교육 서비스 제공
2025,8364,Shimizu Bank Ltd,55101010,은행
2026,4082,Daiichi Kigenso Kagaku Kogyo Co Ltd,51101010,상품 화학
2027,1914,Japan Foundation Engineering Co Ltd,52201020,건설 및 엔지니어링
2028,4662,Focus Systems Corp,57201010,IT 서비스 및 컨설팅
2029,3134,Hamee Corp,53402010,백화점
2030,4575,CanBas Co Ltd,56201040,제약
2031,6232,ACSL Ltd,57104010,전자 장비 및 부품
2032,7455,Paris Miki Holdings Inc,53403090,기타 전문 소매
2033,9765,Ohba Co Ltd,52201020,건설 및 엔지니어링
2034,3154,Medius Holdings Co Ltd,56101020,"의료 장비, 물품 및 유통"
2035,6565,ABhotel Co Ltd,53301010,"호텔, 모텔 및 크루즈 라인"
2036,2440,Gurunavi Inc,57201030,온라인 서비스
2037,1716,Dai-Ichi Cutter Kogyo KK,52201020,건설 및 엔지니어링
2038,2937,St.Cousair Co Ltd,54102020,식품 가공
2039,6294,Okada Aiyon Corp,52102020,중장비 및 차량
2040,7776,CellSeed Inc,56201040,제약
2041,9522,Renewable Japan Co Ltd,59101010,전력 유틸리티
2042,3271,The Global Ltd,60101010,"부동산 임대, 개발 및 운영"
2043,2892,Nihon Shokuhin Kako Co Ltd,54102020,식품 가공
2044,8789,FinTech Global Inc,55102010,투자 은행 및 중개 서비스
2045,4998,Fumakilla Ltd,51101020,농화학제
2046,1972,Sanko Metal Industrial Co Ltd,51201020,철 및 강철
2047,6047,Gunosy Inc,57201020,소프트웨어
2048,7347,Mercuria Holdings Co Ltd,55102020,투자 관리 및 펀드 운영
2049,9168,Rise Consulting Group Inc,52203040,경영 지원 서비스
2050,4493,Cyber Security Cloud Inc,57201030,온라인 서비스
2051,3657,Pole To Win Holdings Inc,57201010,IT 서비스 및 컨설팅
2052,2694,Yakiniku Sakai Holdings Inc,53301020,레스토랑 및 바
2053,4228,Sekisui Kasei Co Ltd,51101010,상품 화학
2054,6798,SMK Corp,57104010,전자 장비 및 부품
2055,8917,First Juken Co Ltd,53203010,주택 건설
2056,4593,Healios KK,56202010,생명 공학 및 의학 연구
2057,7991,Mamiya-OP Co Ltd,53301030,카지노 및 도박
2058,6521,Oxide Corp,57104010,전자 장비 및 부품
2059,3712,Information Planning Co Ltd,57201010,IT 서비스 및 컨설팅
2060,6444,Sanden Corp,53101020,"자동차, 트럭 및 오토바이 부품"
2061,8999,Grandy House Corp,60101010,"부동산 임대, 개발 및 운영"
2062,1431,Lib Work Co Ltd,60101010,"부동산 임대, 개발 및 운영"
2063,5967,Tone Co Ltd,52102010,산업용 기계 및 장비
2064,3023,Rasa Corp,52102010,산업용 기계 및 장비
2065,9537,Hokuriku Gas Co Ltd,59102010,천연가스 유틸리티
2066,4299,Himacs Ltd,57201010,IT 서비스 및 컨설팅
2067,3484,Innovation Holdings Co Ltd,60101010,"부동산 임대, 개발 및 운영"
2068,5918,Takigami Steel Construction Co Ltd,52201020,건설 및 엔지니어링
2069,8091,Nichimo Co Ltd,54102020,식품 가공
2070,3472,Nippon Hotel & Residential Investment Corp,60102040,특수 REITs
2071,7096,StemCell Institute Inc,56102010,의료 시설 및 서비스
2072,3902,Medical Data Vision Co Ltd,56101010,첨단 의료 장비 및 기술
2073,4425,Kudan Inc,57201020,소프트웨어
2074,3329,Towa Food Service Co Ltd,53301020,레스토랑 및 바
2075,7191,Entrust Inc,55101030,소비자 대출
2076,7908,Kimoto Co Ltd,51101010,상품 화학
2077,3454,First Brothers Co Ltd,55102010,투자 은행 및 중개 서비스
2078,6228,JET Co Ltd,57101020,반도체 장비 및 테스트
2079,2812,Yaizu Suisankagaku Industry Co Ltd,54102020,식품 가공
2080,261A,Nihon Suido Consultants Co Ltd,52201020,건설 및 엔지니어링
2081,4888,Stella Pharma Corp,56201040,제약
2082,7932,Nippi Inc,54102020,식품 가공
2083,7472,Toba Inc,52102010,산업용 기계 및 장비
2084,1376,Kaneko Seeds Co Ltd,51101020,농화학제
2085,8798,Advance Create Co Ltd,55301010,복합보험 및 중개인
2086,5845,Zenhoren Co Ltd,55101030,소비자 대출
2087,6040,Nippon Ski Resort Development Co Ltd,53301040,여가 및 오락시설
2088,5285,Yamax Corp,51202010,건설 자재
2089,7600,Japan Medical Dynamic Marketing Inc,56101020,"의료 장비, 물품 및 유통"
2090,6086,Shin Maint Holdings Co Ltd,52203040,경영 지원 서비스
2091,7775,Daiken Medical Co Ltd,56101020,"의료 장비, 물품 및 유통"
2092,7562,Anrakutei Co Ltd,53301020,레스토랑 및 바
2093,2335,Cube System Inc,57201010,IT 서비스 및 컨설팅
2094,3361,Toell Co Ltd,50102030,"오일, 가스 정제 및 마케팅"
2095,6643,Togami Electric Mfg Co Ltd,52102030,전기 부품 및 장비
2096,6616,Torex Semiconductor Ltd,57101010,반도체
2097,5258,Transaction Media Networks Inc,57301010,핀테크
2098,5590,Netstars Co Ltd,57301010,핀테크
2099,3856,Abalance Corp,50201010,재생 가능 에너지 장비 및 서비스
2100,4235,Ultrafabrics Holdings Co Ltd,53202010,직물 및 가죽제품
2101,3489,FaithNetwork Co Ltd,60101010,"부동산 임대, 개발 및 운영"
2102,4026,Konoshima Chemical Co Ltd,53203020,건설 자재 및 비품
2103,6675,Saxa Inc,57102010,통신 및 네트워킹
2104,3937,Ubicom Holdings Inc,57201010,IT 서비스 및 컨설팅
2105,7460,Yagi & Co Ltd,53202010,직물 및 가죽제품
2106,5588,Fast Accounting Co Ltd,57201020,소프트웨어
2107,8165,Senshukai Co Ltd,53402010,백화점
2108,8732,Money Partners Group Co Ltd,55102010,투자 은행 및 중개 서비스
2109,3800,Unirita Inc,57201020,소프트웨어
2110,5586,Laboro.AI Inc,57201010,IT 서비스 및 컨설팅
2111,9248,People Dreams & Technologies Group Co Ltd,52201020,건설 및 엔지니어링
