,Symbol,Name,IndustryCode,Industry
2949,7695,Koukandekirukun Inc,57201030,온라인 서비스
2950,7980,Shigematsu Works Co Ltd,56102010,의료 시설 및 서비스
2951,4624,Isamu Paint Co Ltd,51101010,상품 화학
2952,4531,Yuki Gosei Kogyo Co Ltd,51101090,다각적 화학 산업
2953,7833,IFIS Japan Ltd,52203040,경영 지원 서비스
2954,7445,Right On Co Ltd,53403040,의류 및 액세서리 소매
2955,4262,NIFTY Lifestyle Co Ltd,57201030,온라인 서비스
2956,3173,Cominix Co Ltd,52102010,산업용 기계 및 장비
2957,156A,Material Group Inc,53302010,광고 및 마케팅
2958,130A,Veritas In Silico Inc,56202010,생명 공학 및 의학 연구
2959,173A,Hammock Inc,57201020,소프트웨어
2960,6045,Rentracks Co Ltd,53302010,광고 및 마케팅
2961,2373,Care Twentyone Corp,56102010,의료 시설 및 서비스
2962,8208,Encho Co Ltd,53403020,주택 개조 제품 및 서비스 소매
2963,6158,Waida MFG. Co Ltd,52102010,산업용 기계 및 장비
2964,4012,Axis Co Ltd,57201020,소프트웨어
2965,7677,Yashima & Co Ltd,52102010,산업용 기계 및 장비
2966,5070,Draft Inc,52201020,건설 및 엔지니어링
2967,9212,Green Earth Institute Co Ltd,51101030,특수 화학제
2968,6292,Kawata Mfg. Co Ltd,52102010,산업용 기계 및 장비
2969,1446,Candeal Co Ltd,52201020,건설 및 엔지니어링
2970,4397,TeamSpirit Inc,57201020,소프트웨어
2971,3497,LeTech Corp,60101010,"부동산 임대, 개발 및 운영"
2972,6563,Mirai Works Inc,52203030,고용 서비스
2973,4234,Sun A. Kaken Co Ltd,51302010,용기(종이 제외) 및 포장재
2974,5759,Nippon Denkai Ltd,52102030,전기 부품 및 장비
2975,7111,Inest Inc,53403050,컴퓨터 및 전자 제품 소매
2976,209A,Onodani Machine Co Ltd,52102010,산업용 기계 및 장비
2977,7918,VIA Holdings Inc,53301020,레스토랑 및 바
2978,5533,Elitz Holdings Co Ltd,60101010,"부동산 임대, 개발 및 운영"
2979,5476,Nippon Koshuha Steel Co Ltd,51201020,철 및 강철
2980,8230,Hasegawa Co Ltd,53403090,기타 전문 소매
2981,3426,Atom Livin Tech Co Ltd,53203020,건설 자재 및 비품
2982,9553,MicroAd Inc,53302010,광고 및 마케팅
2983,2788,Apple International Co Ltd,53101010,자동차 및 트럭 제조
2984,5890,Officebusters Corp,52203060,비즈니스 지원 용품
2985,5532,Realgate Inc,60101010,"부동산 임대, 개발 및 운영"
2986,8700,Maruhachi Securities Co Ltd,55102010,투자 은행 및 중개 서비스
2987,9853,Ginza Renoir Co Ltd,53301020,레스토랑 및 바
2988,9885,Charle Co Ltd,53202020,의류 및 액세서리
2989,8835,Taiheiyo Kouhatsu Inc,50101010,석탄
2990,2776,Shinto Holdings Inc,53202020,의류 및 액세서리
2991,3541,Nousouken Corp,54102010,어업 및 농업
2992,6570,Kyowa Corp,53301040,여가 및 오락시설
2993,7214,GMB Corp,53101020,"자동차, 트럭 및 오토바이 부품"
2994,2436,Kyodo Public Relations Co Ltd,53302010,광고 및 마케팅
2995,9340,Aso International Inc,56101020,"의료 장비, 물품 및 유통"
2996,4572,Carna Biosciences Inc,56202010,생명 공학 및 의학 연구
2997,3652,Digital Media Professionals Inc,57101010,반도체
2998,6614,Shikino High Tech Co Ltd,57101020,반도체 장비 및 테스트
2999,3719,Gexeed Co Ltd,57201010,IT 서비스 및 컨설팅
3000,4295,Faith Inc,53302030,엔터테인먼트 제작
3001,7681,Leoclan Co Ltd,56101020,"의료 장비, 물품 및 유통"
3002,3323,Recomm Co Ltd,53403090,기타 전문 소매
3003,5138,Rebase Inc,57201030,온라인 서비스
3004,9265,Yamashita Health Care Holdings Inc,56101020,"의료 장비, 물품 및 유통"
3005,3841,Jedat Inc,57201020,소프트웨어
3006,4379,Photosynth Inc,52203040,경영 지원 서비스
3007,5591,AVILEN Inc,57201020,소프트웨어
3008,7887,Nankai Plywood Co Ltd,53203020,건설 자재 및 비품
3009,7427,Echo Trading Co Ltd,54301020,식품 소매 및 유통
3010,2894,Ishii Food Co Ltd,54102020,식품 가공
3011,1994,Takahashi Curtain Wall Corp,52201020,건설 및 엔지니어링
3012,6325,Takakita Co Ltd,52102020,중장비 및 차량
3013,3143,O' will Corp,54301020,식품 소매 및 유통
3014,9346,Cocorport Inc,54201030,개인 서비스
3015,9625,Cerespo Co Ltd,52203040,경영 지원 서비스
3016,155A,Information Strategy and Technology Co Ltd,57201010,IT 서비스 및 컨설팅
3017,7087,Willtec Co Ltd,52203030,고용 서비스
3018,7022,Sanoyas Holdings Corp,52102010,산업용 기계 및 장비
3019,5575,Globee Inc,63101010,기타 교육 서비스 제공
3020,4556,Kainos Laboratories Inc,56101020,"의료 장비, 물품 및 유통"
3021,6715,Nakayo Inc,57102010,통신 및 네트워킹
3022,7379,CIRCULATION Co Ltd,52203040,경영 지원 서비스
3023,7608,SK Japan Co Ltd,53205010,장난감 및 어린이 제품
3024,245A,INGS Inc,53301020,레스토랑 및 바
3025,1718,Mikikogyo Co Ltd,53203010,주택 건설
3026,3940,Nomura System Corporation Co Ltd,57201010,IT 서비스 및 컨설팅
3027,7039,Bridge International Corp,52203040,경영 지원 서비스
3028,6327,Kitagawa Seiki Co Ltd,52102010,산업용 기계 및 장비
3029,4260,Hybrid Technologies Co Ltd,57201020,소프트웨어
3030,4990,Showa Chemical Industry Co Ltd,51101010,상품 화학
3031,9478,SE Holdings and Incubations Co Ltd,53302040,소비자 출판
3032,4198,Tenda Co Ltd,57201010,IT 서비스 및 컨설팅
3033,4884,Kringle Pharma Inc,56202010,생명 공학 및 의학 연구
3034,3241,Will Co Ltd,60101010,"부동산 임대, 개발 및 운영"
3035,7808,C.S. Lumber Co Inc,51301010,임업 및 목재 제품
3036,7034,Prored Partners Co Ltd,52203040,경영 지원 서비스
3037,7425,Hatsuho Shouji Co Ltd,53203020,건설 자재 및 비품
3038,7370,Enjin Co Ltd,53302010,광고 및 마케팅
3039,2654,Asmo Corp,53301020,레스토랑 및 바
3040,4415,Broad Enterprise Co Ltd,57102010,통신 및 네트워킹
3041,4645,Ichishin Holdings Co Ltd,63101010,기타 교육 서비스 제공
3042,4372,Ymirlink Inc,57201010,IT 서비스 및 컨설팅
3043,6466,TVE Co Ltd,52102010,산업용 기계 및 장비
3044,6836,Plat'Home Co Ltd,57106010,컴퓨터 하드웨어
3045,7135,Japan Craft Holdings Co Ltd,53403090,기타 전문 소매
3046,3131,Shinden Hightex Corp,57101010,반도체
3047,3770,Zappallas Inc,57201030,온라인 서비스
3048,3988,SYS Holdings Co Ltd,57201020,소프트웨어
3049,7847,Graphite Design Inc,53205020,오락용 제품
3050,2995,J-REX Corp,60101010,"부동산 임대, 개발 및 운영"
3051,9219,GiXo Ltd,57201010,IT 서비스 및 컨설팅
3052,7256,Kasai Kogyo Co Ltd,53101020,"자동차, 트럭 및 오토바이 부품"
3053,9235,Ureru Net Advertising Co Ltd,53302010,광고 및 마케팅
3054,7114,Foodison Inc,54102010,어업 및 농업
3055,4060,Rakumo Inc,57201010,IT 서비스 및 컨설팅
3056,5240,monoAI technology Co Ltd,57201020,소프트웨어
3057,6699,Diamond Electric Holdings Co Ltd,57104010,전자 장비 및 부품
3058,8944,Land Business Co Ltd,60101010,"부동산 임대, 개발 및 운영"
3059,7527,Systemsoft Corp,57201010,IT 서비스 및 컨설팅
3060,3322,Alpha Group Inc,53403050,컴퓨터 및 전자 제품 소매
3061,9159,W TOKYO Inc,52203040,경영 지원 서비스
3062,4496,Commerce One Holdings Inc,57201010,IT 서비스 및 컨설팅
3063,6778,Artiza Networks Inc,57102010,통신 및 네트워킹
3064,5446,Hokuetsu Metal Co Ltd,51201020,철 및 강철
3065,1840,Tsuchiya Holdings Co Ltd,60101010,"부동산 임대, 개발 및 운영"
3066,6926,Okaya Electric Industries Co Ltd,52102030,전기 부품 및 장비
3067,3671,Softmax Co Ltd,57201010,IT 서비스 및 컨설팅
3068,9146,Gokendo Co Ltd,52405010,"배달, 우편, 항공 화물 및 육상 물류"
3069,6042,Nikki Co Ltd,53101020,"자동차, 트럭 및 오토바이 부품"
3070,7509,I.A Group Corp,53403010,"자동차 차량, 부품 및 서비스 소매"
3071,3172,Tea Life Co Ltd,53402010,백화점
3072,9479,Impress Holdings Inc,53302040,소비자 출판
3073,5576,O.B.System Inc,57201010,IT 서비스 및 컨설팅
3074,3058,Sanyodo Holdings Inc,53403090,기타 전문 소매
3075,4380,M-mart Inc,57201030,온라인 서비스
3076,6155,Takamatsu Machinery Co Ltd,52102010,산업용 기계 및 장비
3077,5599,S&J Corp,57201010,IT 서비스 및 컨설팅
3078,6888,Acmos Inc,57201010,IT 서비스 및 컨설팅
3079,9051,Senkon Logistics Co Ltd,53403010,"자동차 차량, 부품 및 서비스 소매"
3080,3628,Data Horizon Co Ltd,56101010,첨단 의료 장비 및 기술
3081,4267,Lightworks Corp,57201010,IT 서비스 및 컨설팅
3082,6942,Sophia Holdings Co Ltd,54301010,의약품 소매
3083,6408,Ogura Clutch Co Ltd,53101020,"자동차, 트럭 및 오토바이 부품"
3084,6424,Takamisawa Cybernetics Co Ltd,52102010,산업용 기계 및 장비
3085,6267,General Packer Co Ltd,52102010,산업용 기계 및 장비
3086,5956,Toso Co Ltd,53203020,건설 자재 및 비품
3087,6551,Tsunagu Group Holdings Inc,52203030,고용 서비스
3088,7531,Seiwa Chuo Holdings Corp,51201020,철 및 강철
3089,5936,Toyo Shutter Co Ltd,53203020,건설 자재 및 비품
3090,3815,Media Kobo Inc,57201030,온라인 서비스
3091,9446,Sakai Holdings Co Ltd,53403050,컴퓨터 및 전자 제품 소매
3092,9778,Subaru Co Ltd,63101010,기타 교육 서비스 제공
3093,1383,Berg Earth Co Ltd,54102010,어업 및 농업
3094,4937,Waqoo Inc,53403090,기타 전문 소매
3095,3135,MarketEnterprise Co Ltd,57201030,온라인 서비스
3096,4926,C'Bon Cosmetics Co Ltd,54201020,개인 생활 필수 용품
3097,3267,Phil Company Inc,52201020,건설 및 엔지니어링
3098,7812,Crestec Inc,52203040,경영 지원 서비스
3099,6837,Kyosha Co Ltd,57101010,반도체
3100,7049,Shikigaku Co Ltd,52203040,경영 지원 서비스
3101,6897,Twinbird Corp,53204030,"가전제품, 도구 및 가정 용품"
3102,7502,Plaza Holdings Co Ltd,53403050,컴퓨터 및 전자 제품 소매
3103,5033,Nulab Inc,57201020,소프트웨어
3104,4960,Chemipro Kasei Kaisha Ltd,51101010,상품 화학
3105,1418,Interlife Holdings Co Ltd,52201020,건설 및 엔지니어링
3106,7953,Kikusui Chemical Industries Co Ltd,53203020,건설 자재 및 비품
3107,9060,Japan Logistic Systems Corp,52405030,지상 화물 및 물류
3108,3474,G-Factory Co Ltd,52203040,경영 지원 서비스
3109,4119,Nippon Pigment Holdings Co Ltd,51101030,특수 화학제
3110,3686,DLE Inc,53302010,광고 및 마케팅
3111,3237,Intrance Co Ltd,60101010,"부동산 임대, 개발 및 운영"
3112,6092,EnBio Holdings Inc,52203010,환경 서비스 및 장비
3113,9867,Solekia Ltd,57201010,IT 서비스 및 컨설팅
3114,3169,Misawa & Co Ltd,53403030,가정용 가구 소매
3115,3726,4Cs HD Co Ltd,53403090,기타 전문 소매
3116,8518,Japan Asia Investment Co Ltd,55102020,투자 관리 및 펀드 운영
3117,6776,Tensho Electric Industries Co Ltd,51101010,상품 화학
3118,4486,Unite and Grow Inc,52203030,고용 서비스
3119,6034,MRT Inc,52203030,고용 서비스
3120,5596,OutlookConsulting Co Ltd,57201020,소프트웨어
3121,5283,Takamisawa Co Ltd,51202010,건설 자재
3122,5939,Otani Kogyo Co Ltd,52102040,중전기장비
3123,5900,Daiken Co Ltd,53203020,건설 자재 및 비품
3124,4728,Tose Co Ltd,57201020,소프트웨어
3125,2397,DNA Chip Research Inc,56202010,생명 공학 및 의학 연구
3126,5990,Super Tool Co Ltd,52102010,산업용 기계 및 장비
3127,3537,Shoei Yakuhin Co Ltd,51101010,상품 화학
3128,7807,Kowa Co Ltd,56101020,"의료 장비, 물품 및 유통"
3129,2376,SCiNEX Corp,53302040,소비자 출판
3130,8891,AMG Holdings Co Ltd,60101010,"부동산 임대, 개발 및 운영"
3131,6907,Geomatec Co Ltd,57104010,전자 장비 및 부품
3132,9876,Cox Co Ltd,53403040,의류 및 액세서리 소매
3133,4274,Hosoya Pyro-Engineering Co Ltd,51101010,상품 화학
3134,7127,Ikka Holdings Co Ltd,53301020,레스토랑 및 바
3135,8226,Rikei Corp,57201010,IT 서비스 및 컨설팅
3136,9344,Axis Consulting Corp,52203030,고용 서비스
3137,3896,Awa Paper & Technological Co Inc,53101020,"자동차, 트럭 및 오토바이 부품"
3138,4429,Ricksoft Co Ltd,57201010,IT 서비스 및 컨설팅
3139,8260,Izutsuya Co Ltd,53402010,백화점
3140,3261,Grandes Inc,60101010,"부동산 임대, 개발 및 운영"
3141,6757,OSG Corporation Co Ltd,53204030,"가전제품, 도구 및 가정 용품"
3142,3604,Kawamoto Corp,56101020,"의료 장비, 물품 및 유통"
3143,6771,Ikegami Tsushinki Co Ltd,57102010,통신 및 네트워킹
3144,5133,Terilogy Holdings Corp,57102010,통신 및 네트워킹
3145,6597,HPC Systems Inc,57106010,컴퓨터 하드웨어
3146,3059,Hiraki Co Ltd,53402020,할인점
3147,4287,Justplanning Inc,57201010,IT 서비스 및 컨설팅
3148,9036,Tohbu Network Co Ltd,52405030,지상 화물 및 물류
3149,9366,Sanritsu Corp,52405010,"배달, 우편, 항공 화물 및 육상 물류"
3150,6838,Tamagawa Holdings Co Ltd,57104010,전자 장비 및 부품
3151,6286,Seiko Corp,53403010,"자동차 차량, 부품 및 서비스 소매"
3152,3667,Enish Inc,57201020,소프트웨어
3153,2917,Ohmoriya Co Ltd,54102020,식품 가공
3154,2795,Nippon Primex Inc,57106010,컴퓨터 하드웨어
3155,2454,All About Inc,53302010,광고 및 마케팅
3156,7078,Inclusive Inc,53302010,광고 및 마케팅
3157,3933,CHIeru Co Ltd,57201020,소프트웨어
3158,4412,Science Arts Inc,57201010,IT 서비스 및 컨설팅
3159,3839,ODK Solutions Co Ltd,57201010,IT 서비스 및 컨설팅
3160,4570,Immuno-Biological Laboratories Co Ltd,56201040,제약
3161,6495,Miyairi Valve MFG Co Ltd,52102010,산업용 기계 및 장비
3162,3851,Nippon Ichi Software Inc,57201020,소프트웨어
3163,5527,property technologies Inc,60101020,부동산 서비스
3164,3816,Daiwa Computer Co Ltd,57201020,소프트웨어
3165,9973,KOZO Holdings Co Ltd,53301020,레스토랑 및 바
3166,7126,Global Style Co Ltd,53202020,의류 및 액세서리
3167,2464,Aoba-BBT Inc,52203070,전문 정보 서비스
3168,2408,KG Intelligence Co Ltd,53302040,소비자 출판
3169,9282,Ichigo Green Infrastructure Investment Corp,55501030,폐쇄형 펀드
3170,5724,Asaka Riken Co Ltd,51201010,금 제외 귀금속 및 광물
3171,1451,KHC Ltd,53203010,주택 건설
3172,4437,Gooddays Holdings Inc,57201010,IT 서비스 및 컨설팅
3173,5865,My Farm Inc,54102010,어업 및 농업
3174,6964,Sanko Co Ltd,52102010,산업용 기계 및 장비
3175,3948,Hikari Business Form Co Ltd,52203020,상업 인쇄 서비스
3176,4040,Nankai Chemical Co Ltd,51101090,다각적 화학 산업
3177,7091,Living Platform Ltd,56102010,의료 시설 및 서비스
3178,5699,Ibokin Co Ltd,52203010,환경 서비스 및 장비
3179,2134,Kitahama Capital Partners Co Ltd,55102020,투자 관리 및 펀드 운영
3180,3067,Tokyo Ichiban Foods Co Ltd,53301020,레스토랑 및 바
3181,7916,Mitsumura Printing Co Ltd,52203020,상업 인쇄 서비스
3182,2179,Seigakusha Co Ltd,63101010,기타 교육 서비스 제공
3183,9385,Shoei Corp,51302010,용기(종이 제외) 및 포장재
3184,4584,Kidswell Bio Corp,56202010,생명 공학 및 의학 연구
3185,3557,United & Collective Co Ltd,53301020,레스토랑 및 바
3186,8887,Cumica Corp,60101010,"부동산 임대, 개발 및 운영"
3187,9355,Rinko Corp,52407020,항만 운영 및 서비스
3188,3936,Globalway Inc,57201010,IT 서비스 및 컨설팅
3189,9929,Heiwa Paper Co Ltd,51301020,종이 제품
3190,9969,Shokubun Co Ltd,53301020,레스토랑 및 바
3191,2136,HIP Corp,52203030,고용 서비스
3192,6343,Freesia Macross Corp,53203010,주택 건설
3193,6993,Daikokuya Holdings Co Ltd,53403090,기타 전문 소매
3194,2911,Asahimatsu Foods Co Ltd,54102020,식품 가공
3195,3965,Capital Asset Planning Inc,57301010,핀테크
3196,6054,Livesense Inc,57201010,IT 서비스 및 컨설팅
3197,6171,CE Management Integrated Laboratory Co Ltd,52201020,건설 및 엔지니어링
3198,5542,Shinhokoku Material Corp,51201020,철 및 강철
3199,8025,Tsukamoto Corporation Co Ltd,53202020,의류 및 액세서리
3200,4360,MANAC Chemical Partners Co Ltd,51101090,다각적 화학 산업
3201,5753,Nippon Shindo Co Ltd,51201050,특수 채굴 및 금속
3202,2341,Arbeit-Times Co Ltd,53302040,소비자 출판
3203,148A,Hatch Work Co Ltd,57201010,IT 서비스 및 컨설팅
3204,9835,Juntendo Co Ltd,53403020,주택 개조 제품 및 서비스 소매
3205,2481,Townnews-Sha Co Ltd,53302040,소비자 출판
3206,6166,Nakamura Choukou Co Ltd,52102010,산업용 기계 및 장비
3207,6297,Koken Boring Machine Co Ltd,52102010,산업용 기계 및 장비
3208,3556,RenetJapanGroup Inc,53403090,기타 전문 소매
3209,7351,Goodpatch Inc,57201010,IT 서비스 및 컨설팅
3210,7208,Kanemitsu Corp,53101020,"자동차, 트럭 및 오토바이 부품"
3211,4594,BrightPath Biotherapeutics Co Ltd,56202010,생명 공학 및 의학 연구
3212,4625,Atomix Co Ltd,51101010,상품 화학
3213,7097,Sakurasaku Plus Co Ltd,54201030,개인 서비스
3214,7923,Toin Corp,51302020,종이 포장재
3215,4881,FunPep Co Ltd,56202010,생명 공학 및 의학 연구
3216,3495,Koryojyuhan Co Ltd,60101020,부동산 서비스
3217,7060,Geechs Inc,57201010,IT 서비스 및 컨설팅
3218,2304,CSS Holdings Ltd,53302030,엔터테인먼트 제작
3219,4177,I-Plug Inc,52203030,고용 서비스
3220,3024,Create Corp,53203020,건설 자재 및 비품
3221,3190,Hotman Co Ltd,53403010,"자동차 차량, 부품 및 서비스 소매"
3222,9760,Shingakukai Holdings Co Ltd,63101010,기타 교육 서비스 제공
3223,5355,Nippon Crucible Co Ltd,52102010,산업용 기계 및 장비
3224,9444,Toshin Holdings Co Ltd,57401020,무선 통신 서비스
3225,4586,Medrx Co Ltd,56201040,제약
3226,5571,Excite Holdings Co Ltd,57401020,무선 통신 서비스
3227,6336,Ishii Hyoki Co Ltd,57101010,반도체
3228,7975,Lihit Lab Inc,52203060,비즈니스 지원 용품
3229,5491,Nippon Kinzoku Co Ltd,51201020,철 및 강철
3230,4829,Nihon Enterprise Co Ltd,57201010,IT 서비스 및 컨설팅
3231,6342,Taihei Machinery Works Ltd,52102010,산업용 기계 및 장비
3232,2411,Gendai Agency Inc,53302010,광고 및 마케팅
3233,2449,PRAP Japan Inc,53302010,광고 및 마케팅
3234,2480,System Location Co Ltd,57201010,IT 서비스 및 컨설팅
3235,3625,Techfirm Holdings Inc,57201010,IT 서비스 및 컨설팅
3236,4172,Towa Hi System Co Ltd,57201020,소프트웨어
3237,1758,Taiyo Kisokogyo Co Ltd,52201020,건설 및 엔지니어링
3238,2215,First Baking Co Ltd,54102020,식품 가공
3239,4892,Cyfuse Biomedical KK,56202010,생명 공학 및 의학 연구
3240,9362,Hyoki Kaiun Kaisha Ltd,52405020,해양 화물 및 물류
3241,3280,STrust Co Ltd,60101010,"부동산 임대, 개발 및 운영"
3242,3695,GMO Research & AI Inc,53302010,광고 및 마케팅
3243,3680,Hotto Link Inc,53302010,광고 및 마케팅
3244,1380,Akikawa Foods & Farms Co Ltd,54102020,식품 가공
3245,7538,Daisui Co Ltd,54102010,어업 및 농업
3246,6360,Tokyo Automatic Machinery Works Ltd,52102010,산업용 기계 및 장비
3247,3238,Central General Development Co Ltd,60101010,"부동산 임대, 개발 및 운영"
3248,6577,Bestone.Com Co Ltd,53301040,여가 및 오락시설
3249,7555,Ota Floriculture Auction Co Ltd,54102010,어업 및 농업
3250,6901,Sawafuji Electric Co Ltd,52102030,전기 부품 및 장비
3251,2286,Hayashikane Sangyo Co Ltd,54102010,어업 및 농업
3252,7150,Shimane Bank Ltd,55101010,은행
3253,4388,AI Inc,57201020,소프트웨어
3254,4171,Global Information Inc,53302010,광고 및 마케팅
3255,9776,Sapporo Clinical Laboratory Inc,54301010,의약품 소매
3256,7284,Meiwa Industry Co Ltd,53101020,"자동차, 트럭 및 오토바이 부품"
3257,2493,E-Supportlink Ltd,57201010,IT 서비스 및 컨설팅
3258,7273,Ikuyo Co Ltd,53101020,"자동차, 트럭 및 오토바이 부품"
3259,4615,Shinto Paint Co Ltd,51101010,상품 화학
3260,2876,Delsole Corp,54102020,식품 가공
3261,5577,Aidemy Inc,57201010,IT 서비스 및 컨설팅
3262,7217,Tein Inc,53101020,"자동차, 트럭 및 오토바이 부품"
3263,2747,Hokuyu Lucky Co Ltd,54301020,식품 소매 및 유통
3264,6518,Sanso Electric Co Ltd,52102010,산업용 기계 및 장비
3265,4076,CNS Co Ltd,57201010,IT 서비스 및 컨설팅
3266,4242,Takagi Seiko Corp,53101020,"자동차, 트럭 및 오토바이 부품"
3267,7863,Hiraga Co Ltd,52203020,상업 인쇄 서비스
3268,5742,NIC Autotec Inc,52102010,산업용 기계 및 장비
3269,4391,Logizard Co Ltd,57201030,온라인 서비스
3270,6185,SMN Corp,57201030,온라인 서비스
3271,8115,Moonbat Co Ltd,53202020,의류 및 액세서리
3272,1844,Ohmori Co Ltd,52201020,건설 및 엔지니어링
3273,7399,Nansin Co Ltd,52102010,산업용 기계 및 장비
3274,4447,PBsystems Inc,57201010,IT 서비스 및 컨설팅
3275,2985,First Stage Corp,60101020,부동산 서비스
3276,5986,Molitec Steel Co Ltd,51201020,철 및 강철
3277,7215,Faltec Co Ltd,53101020,"자동차, 트럭 및 오토바이 부품"
3278,5255,Monstarlab Holdings Inc,57201010,IT 서비스 및 컨설팅
3279,3627,Tecmira Holdings Inc,57201010,IT 서비스 및 컨설팅
3280,3045,Kawasaki & Co Ltd,53202020,의류 및 액세서리
3281,4334,Yuke's Co Ltd,53302030,엔터테인먼트 제작
3282,253A,ETS Group Co Ltd,52201020,건설 및 엔지니어링
3283,6552,GameWith Inc,57201030,온라인 서비스
3284,4351,Yamada Servicer Synthetic Office Co Ltd,55101050,기업 금융 서비스
3285,7902,Sonocom Co Ltd,57104010,전자 장비 및 부품
3286,7080,Sportsfield Co Ltd,52203030,고용 서비스
3287,4750,Daisan Co Ltd,52201020,건설 및 엔지니어링
3288,6096,RareJob Inc,63103010,전문 및 비즈니스 교육
3289,3997,Trade Works Co Ltd,57201020,소프트웨어
3290,2754,Tokatsu Holdings Co Ltd,53403010,"자동차 차량, 부품 및 서비스 소매"
3291,9361,Fushiki Kairiku Unso Co Ltd,52407020,항만 운영 및 서비스
3292,1841,Sanyu Construction Co Ltd,52201020,건설 및 엔지니어링
3293,6659,Media Links Co Ltd,57102010,통신 및 네트워킹
3294,5603,Kogi Corp,51201020,철 및 강철
3295,6634,NCXX Group Inc,53403040,의류 및 액세서리 소매
3296,8617,Kosei Securities Co Ltd,55102010,투자 은행 및 중개 서비스
3297,3674,Aucfan Co Ltd,57201030,온라인 서비스
3298,5856,Life Intelligent Enterprise Holdings Co Ltd,54301020,식품 소매 및 유통
3299,4450,Power Solutions Ltd,57201010,IT 서비스 및 컨설팅
3300,5259,BBD Initiative Inc,57201010,IT 서비스 및 컨설팅
3301,4935,Liberta Co Ltd,56201040,제약
3302,3359,cotta Co Ltd,54301020,식품 소매 및 유통
3303,7353,KIYO Learning Co Ltd,52203070,전문 정보 서비스
3304,7314,Odawara Auto-Machine Mfg Co Ltd,52203060,비즈니스 지원 용품
3305,4386,SIG Group Co Ltd,57201010,IT 서비스 및 컨설팅
3306,3286,Trust Holdings Inc,52407030,고속도로 및 철도
3307,3698,CRI Middleware Co Ltd,57201010,IT 서비스 및 컨설팅
3308,4976,Toyo Drilube Co Ltd,51101030,특수 화학제
3309,4075,Brains Technology Inc,57201010,IT 서비스 및 컨설팅
3310,3161,Azearth Corp,52203060,비즈니스 지원 용품
3311,4705,Clip Corp,63101010,기타 교육 서비스 제공
3312,3682,Encourage Technologies Co Ltd,57201010,IT 서비스 및 컨설팅
3313,5994,Fine Sinter Co Ltd,53101020,"자동차, 트럭 및 오토바이 부품"
3314,6072,Jibannet Holdings Co Ltd,52203040,경영 지원 서비스
3315,6494,NFK Holdings Co Ltd,52102030,전기 부품 및 장비
3316,5578,AR Advanced Technology Inc,57201010,IT 서비스 및 컨설팅
3317,7113,Manabe Interior Hearts Co Ltd,53403030,가정용 가구 소매
3318,5609,Nippon Chuzo KK,51201020,철 및 강철
3319,3317,Flying Garden Co Ltd,53301020,레스토랑 및 바
3320,1997,Akatsuki Eazima Co Ltd,52201020,건설 및 엔지니어링
3321,6596,Tsukubaseiko Co Ltd,57101010,반도체
3322,6218,Enshu Ltd,52102010,산업용 기계 및 장비
3323,3895,Havix Corp,53202010,직물 및 가죽제품
3324,4487,Spacemarket Inc,60101020,부동산 서비스
3325,6038,IID Inc,53302010,광고 및 마케팅
3326,7804,B&P Co Ltd,52203020,상업 인쇄 서비스
3327,5534,Angel Group Inc,53301010,"호텔, 모텔 및 크루즈 라인"
3328,7983,Miroku Corp,52101010,항공우주 및 방위
3329,5525,Frontier Holdings Co Ltd,60101020,부동산 서비스
3330,3437,Tokuden Co Ltd,52203040,경영 지원 서비스
3331,3536,Axas Holdings Co Ltd,53403090,기타 전문 소매
3332,5189,Sakura Rubber Co Ltd,53101030,타이어 및 고무 제품
3333,7036,eMnet Japan Co Ltd,53302010,광고 및 마케팅
3334,7515,Maruyoshi Center Inc,54301020,식품 소매 및 유통
3335,3524,Nitto Seimo Co Ltd,52203060,비즈니스 지원 용품
3336,5250,Prime Strategy Co Ltd,57201010,IT 서비스 및 컨설팅
3337,9565,Gloe Inc,53301040,여가 및 오락시설
3338,4484,Lancers Inc,52203030,고용 서비스
3339,3622,Netyear Group Corp,57201030,온라인 서비스
3340,7120,SHINKO Inc,57201010,IT 서비스 및 컨설팅
3341,7361,Human Creation Holdings Inc,52203030,고용 서비스
3342,4319,TAC Co Ltd,63101010,기타 교육 서비스 제공
3343,3927,Fuva Brain Ltd,57201020,소프트웨어
3344,6334,Meiji Machine Co Ltd,52102010,산업용 기계 및 장비
3345,4930,Graphico Inc,53403090,기타 전문 소매
3346,3422,J-Max Co Ltd,53101020,"자동차, 트럭 및 오토바이 부품"
3347,7625,Global-Dining Inc,53301020,레스토랑 및 바
3348,3444,Kikuchi Seisakusho Co Ltd,52102010,산업용 기계 및 장비
3349,2291,Fukutome Meat Packers Ltd,54102020,식품 가공
3350,5031,Moi Corp,57201020,소프트웨어
3351,6549,DM Solutions Co Ltd,53302010,광고 및 마케팅
3352,6192,HyAS&Co. Inc,52203040,경영 지원 서비스
3353,2961,Nitcho Corp,52102010,산업용 기계 및 장비
3354,8783,GFA Co Ltd,55102020,투자 관리 및 펀드 운영
3355,3583,AuBEX Corp,52203060,비즈니스 지원 용품
3356,2999,Home Position Co Ltd,60101010,"부동산 임대, 개발 및 운영"
3357,8746,UNBANKED Inc,55102010,투자 은행 및 중개 서비스
3358,3945,Superbag Co Ltd,51302020,종이 포장재
3359,145A,L is B Corp,57201010,IT 서비스 및 컨설팅
3360,265A,Hmcomm Inc,57201010,IT 서비스 및 컨설팅
