,Symbol,Name,IndustryCode,Industry
856,7611,Hiday Hidaka Corp,53301020,레스토랑 및 바
857,7433,Hakuto Co Ltd,57101010,반도체
858,1926,Raito Kogyo Co Ltd,52201020,건설 및 엔지니어링
859,9722,Fujita Kanko Inc,53301010,"호텔, 모텔 및 크루즈 라인"
860,5481,Sanyo Special Steel Co Ltd,51201020,철 및 강철
861,3106,Kurabo Industries Ltd,53202010,직물 및 가죽제품
862,8544,Keiyo Bank Ltd,55101010,은행
863,8074,Yuasa Trading Co Ltd,53203020,건설 자재 및 비품
864,8714,Senshu Ikeda Holdings Inc,55101010,은행
865,8367,Nanto Bank Ltd,55101010,은행
866,9699,Nishio Holdings Co Ltd,52203040,경영 지원 서비스
867,3593,Hogy Medical Co Ltd,56101020,"의료 장비, 물품 및 유통"
868,2653,Aeon Kyushu Co Ltd,53402010,백화점
869,9039,Sakai Moving Service Co Ltd,52405030,지상 화물 및 물류
870,4107,Ise Chemicals Corp,51101010,상품 화학
871,6727,Wacom Co Ltd,57106010,컴퓨터 하드웨어
872,8219,Aoyama Trading Co Ltd,53403040,의류 및 액세서리 소매
873,2715,Elematec Corp,57104010,전자 장비 및 부품
874,3087,DOUTOR NICHIRES Holdings Co Ltd,53301020,레스토랑 및 바
875,5310,Toyo Tanso Co Ltd,52102030,전기 부품 및 장비
876,6498,Kitz Corp,52102010,산업용 기계 및 장비
877,8958,Global One Real Estate Investment Corp,60102020,상업용 REITs
878,8131,Mitsuuroko Group Holdings Co Ltd,50102030,"오일, 가스 정제 및 마케팅"
879,4975,JCU Corp,51101030,특수 화학제
880,4919,Milbon Co Ltd,54201020,개인 생활 필수 용품
881,6455,Morita Holdings Corp,52102020,중장비 및 차량
882,8014,Chori Co Ltd,51101010,상품 화학
883,3201,Japan Wool Textile Co Ltd,53202010,직물 및 가죽제품
884,8892,Es-con Japan Ltd,60101010,"부동산 임대, 개발 및 운영"
885,1885,Toa Corp (Tokyo),52201020,건설 및 엔지니어링
886,6486,Eagle Industry Co Ltd,52102010,산업용 기계 및 장비
887,8032,Japan Pulp & Paper Co Ltd,51301020,종이 제품
888,3962,Change Holdings Inc,57201010,IT 서비스 및 컨설팅
889,7575,Japan Lifeline Co Ltd,56101020,"의료 장비, 물품 및 유통"
890,3863,Nippon Paper Industries Co Ltd,51301020,종이 제품
891,2590,DyDo Group Holdings Inc,54101030,무알콜 음료
892,6737,Eizo Corp,57106010,컴퓨터 하드웨어
893,7552,Happinet Corp,53205010,장난감 및 어린이 제품
894,1762,Takamatsu Construction Group Co Ltd,52201020,건설 및 엔지니어링
895,2157,Koshidaka Holdings Co Ltd,53301040,여가 및 오락시설
896,8336,Musashino Bank Ltd,55101010,은행
897,1952,Shin Nippon Air Technologies Co Ltd,52201020,건설 및 엔지니어링
898,6183,Bellsystem24 Holdings Inc,52203040,경영 지원 서비스
899,6425,Universal Entertainment Corp,53301010,"호텔, 모텔 및 크루즈 라인"
900,5975,Topre Corp,53101020,"자동차, 트럭 및 오토바이 부품"
901,7199,Premium Group Co Ltd,55101030,소비자 대출
902,2384,SBS Holdings Inc,52405030,지상 화물 및 물류
903,2760,Tokyo Electron Device Ltd,57101010,반도체
904,7071,Amvis Holdings Inc,56102010,의료 시설 및 서비스
905,9110,NS United Kaiun Kaisha Ltd,52405020,해양 화물 및 물류
906,4471,Sanyo Chemical Industries Ltd,51101010,상품 화학
907,4569,Kyorin Pharmaceutical Co Ltd,56201040,제약
908,8117,Central Automotive Products Ltd,53101020,"자동차, 트럭 및 오토바이 부품"
909,9037,Hamakyorex Co Ltd,52405030,지상 화물 및 물류
910,1879,Shinnihon Corp,52201020,건설 및 엔지니어링
911,5122,Okamoto Industries Inc,51101010,상품 화학
912,4956,Konishi Co Ltd,51101010,상품 화학
913,9267,Genky DrugStores Co Ltd,54301010,의약품 소매
914,50765,Infroneer Holdings P-1 Prf Shs,52201020,건설 및 엔지니어링
915,215A,Timee Inc,57201020,소프트웨어
916,7931,Mirai Industry Co Ltd,52102030,전기 부품 및 장비
917,5482,Aichi Steel Corp,51201020,철 및 강철
918,5703,Nippon Light Metal Holdings Co Ltd,51201030,알루미늄
919,6947,Zuken Inc,57201010,IT 서비스 및 컨설팅
920,6104,Shibaura Machine Co Ltd,52102010,산업용 기계 및 장비
921,3445,RS Technologies Co Ltd,57101010,반도체
922,5988,Piolax Inc,53101020,"자동차, 트럭 및 오토바이 부품"
923,1407,West Holdings Corp,52201020,건설 및 엔지니어링
924,7224,ShinMaywa Industries Ltd,52102020,중장비 및 차량
925,2220,Kameda Seika Co Ltd,54102020,식품 가공
926,2004,Showa Sangyo Co Ltd,54102020,식품 가공
927,4485,JTOWER Inc,52201020,건설 및 엔지니어링
928,9716,Nomura Co Ltd,52203040,경영 지원 서비스
929,4099,Shikoku Kasei Holdings Corp,51101010,상품 화학
930,1982,Hibiya Engineering Ltd,52201020,건설 및 엔지니어링
931,7226,Kyokuto Kaihatsu Kogyo Co Ltd,52102020,중장비 및 차량
932,4369,Tri Chemical Laboratories Inc,51101030,특수 화학제
933,9902,Nichiden Corp,52102010,산업용 기계 및 장비
934,2692,Itochu-Shokuhin Co Ltd,54301020,식품 소매 및 유통
935,7283,Aisan Industry Co Ltd,53101020,"자동차, 트럭 및 오토바이 부품"
936,3002,Gunze Ltd,53202020,의류 및 액세서리
937,4293,Septeni Holdings Co Ltd,53302010,광고 및 마케팅
938,8934,Sun Frontier Fudousan Co Ltd,60101010,"부동산 임대, 개발 및 운영"
939,7826,Furuya Metal Co Ltd,51201010,금 제외 귀금속 및 광물
940,7972,Itoki Corp,52203060,비즈니스 지원 용품
941,4044,Central Glass Co Ltd,51101090,다각적 화학 산업
942,6345,Aichi Corp,52102020,중장비 및 차량
943,6524,Kohoku Kogyo Co Ltd,57104010,전자 장비 및 부품
944,1946,Toenec Corp,52201020,건설 및 엔지니어링
945,2742,Halows Co Ltd,54301020,식품 소매 및 유통
946,4526,Riken Vitamin Co Ltd,54102020,식품 가공
947,6814,Furuno Electric Co Ltd,57102010,통신 및 네트워킹
948,4746,Toukei Computer Co Ltd,57201020,소프트웨어
949,9066,Nissin Corp,52405010,"배달, 우편, 항공 화물 및 육상 물류"
950,5352,Krosaki Harima Corp,51202010,건설 자재
951,3487,CRE Logistics REIT Inc,60102020,상업용 REITs
952,2588,Premium Water Holdings Inc,54101030,무알콜 음료
953,7915,Nissha Co Ltd,57104010,전자 장비 및 부품
954,6200,Insource Co Ltd,63103010,전문 및 비즈니스 교육
955,9889,JBCC Holdings Inc,57201010,IT 서비스 및 컨설팅
956,8059,Daiichi Jitsugyo Co Ltd,52102010,산업용 기계 및 장비
957,9247,TRE Holdings Corp,52203010,환경 서비스 및 장비
958,6810,Maxell Ltd,57104010,전자 장비 및 부품
959,4290,Prestige International Inc,52203040,경영 지원 서비스
960,2292,S Foods Inc,54102020,식품 가공
961,8255,Axial Retailing Inc,54301020,식품 소매 및 유통
962,6877,Obara Group Inc,52102010,산업용 기계 및 장비
963,6996,Nichicon Corp,52102030,전기 부품 및 장비
964,6235,Optorun Co Ltd,57104010,전자 장비 및 부품
965,8386,Hyakujushi Bank Ltd,55101010,은행
966,8600,Tomony Holdings Inc,55101010,은행
967,8244,Kintetsu Department Store Co Ltd,53402010,백화점
968,1663,K&O Energy Group Inc,50102020,"오일, 가스 탐사 및 생산"
969,6652,IDEC Corp,52102030,전기 부품 및 장비
970,4549,Eiken Chemical Co Ltd,56101020,"의료 장비, 물품 및 유통"
971,6366,Chiyoda Corp,52201020,건설 및 엔지니어링
972,3101,Toyobo Co Ltd,51101010,상품 화학
973,6088,SIGMAXYZ Holdings Inc,52203040,경영 지원 서비스
974,4552,JCR Pharmaceuticals Co Ltd,56201040,제약
975,5943,Noritz Corp,53204030,"가전제품, 도구 및 가정 용품"
976,8977,Hankyu Hanshin REIT Inc,60102020,상업용 REITs
977,9260,Nishimoto Co Ltd,54301020,식품 소매 및 유통
978,8708,Aizawa Securities Group Co Ltd,55102010,투자 은행 및 중개 서비스
979,6703,Oki Electric Industry Co Ltd,57102010,통신 및 네트워킹
980,6463,TPR Co Ltd,53101020,"자동차, 트럭 및 오토바이 부품"
981,8132,Sinanen Holdings Co Ltd,50102030,"오일, 가스 정제 및 마케팅"
982,8016,Onward Holdings Co Ltd,53202020,의류 및 액세서리
983,2326,Digital Arts Inc,57201020,소프트웨어
984,4633,Sakata Inx Corp,51101030,특수 화학제
985,9413,TV Tokyo Holdings Corp,53302020,방송
986,9551,Metawater Co Ltd,52201020,건설 및 엔지니어링
987,7250,Pacific Industrial Co Ltd,53101020,"자동차, 트럭 및 오토바이 부품"
988,2146,UT Group Co Ltd,52203030,고용 서비스
989,7513,Kojima Co Ltd,53403050,컴퓨터 및 전자 제품 소매
990,4365,Matsumoto Yushi-Seiyaku Co Ltd,51101010,상품 화학
991,8125,Wakita & Co Ltd,52102020,중장비 및 차량
992,7177,GMO Financial Holdings Inc,55102010,투자 은행 및 중개 서비스
993,2168,Pasona Group Inc,52203030,고용 서비스
994,7447,Nagaileben Co Ltd,56101020,"의료 장비, 물품 및 유통"
995,9729,Tokai Corp (Gifu),52203040,경영 지원 서비스
996,8793,NEC Capital Solutions Ltd,55101050,기업 금융 서비스
997,7917,Zacros Corp,51302010,용기(종이 제외) 및 포장재
998,7456,Matsuda Sangyo Co Ltd,52203010,환경 서비스 및 장비
999,6474,Nachi-Fujikoshi Corp,52102010,산업용 기계 및 장비
1000,4216,Asahi Yukizai Corp,51101010,상품 화학
1001,8361,Ogaki Kyoritsu Bank Ltd,55101010,은행
1002,2979,SOSiLA Logistics REIT Inc,60102020,상업용 REITs
1003,2329,Tohokushinsha Film Corp,53302010,광고 및 마케팅
1004,6379,Raiznext Corp,52201020,건설 및 엔지니어링
1005,2117,Wellneo Sugar Co Ltd,54102020,식품 가공
1006,3493,Advance Logistics Investment Corp,60102020,상업용 REITs
1007,262A,Intermestic Inc,56101020,"의료 장비, 물품 및 유통"
1008,3028,Alpen Co Ltd,53403090,기타 전문 소매
1009,7483,Doshisha Co Ltd,53204030,"가전제품, 도구 및 가정 용품"
1010,5351,Shinagawa Refractories Co Ltd,51202010,건설 자재
1011,3459,Samty Residential Investment Corp,60102030,주거용 REITs
1012,5195,Bando Chemical Industries Ltd,52102010,산업용 기계 및 장비
1013,3492,Takara Leben Real Estate Investment Corp,60102010,복합부동산 REITs
1014,9543,Shizuoka Gas Co Ltd,59102010,천연가스 유틸리티
1015,3836,Avant Group Corp,57201010,IT 서비스 및 컨설팅
1016,6363,Torishima Pump Mfg Co Ltd,52102010,산업용 기계 및 장비
1017,7421,Kappa Create Co Ltd,53301020,레스토랑 및 바
1018,6080,M&A Capital Partners Co Ltd,55102010,투자 은행 및 중개 서비스
1019,6740,Japan Display Inc,57104010,전자 장비 및 부품
1020,6284,Nissei ASB Machine Co Ltd,52102010,산업용 기계 및 장비
1021,5440,Kyoei Steel Ltd,51201020,철 및 강철
1022,2353,Nippon Parking Development Co Ltd,52407030,고속도로 및 철도
1023,6620,Miyakoshi Holdings Inc,60101010,"부동산 임대, 개발 및 운영"
1024,3476,Mirai Corp,60102020,상업용 REITs
1025,8337,Chiba Kogyo Bank Ltd,55101010,은행
1026,3854,I'LL Inc,57201010,IT 서비스 및 컨설팅
1027,8079,Shoei Foods Corp,54102020,식품 가공
1028,6254,Nomura Micro Science Co Ltd,52102010,산업용 기계 및 장비
1029,9519,Renova Inc,59101010,전력 유틸리티
1030,7718,Star Micronics Co Ltd,52102010,산업용 기계 및 장비
1031,4189,KH Neochem Co Ltd,51101010,상품 화학
1032,8818,Keihanshin Building Co Ltd,60101010,"부동산 임대, 개발 및 운영"
1033,6459,Daiwa Industries Ltd,52102010,산업용 기계 및 장비
1034,6282,Oiles Corp,52102010,산업용 기계 및 장비
1035,7979,Shofu Inc,56101020,"의료 장비, 물품 및 유통"
1036,3156,Restar Corp,57101010,반도체
1037,4413,Baudroie Inc,57201010,IT 서비스 및 컨설팅
1038,9692,Computer Engineering & Consulting Ltd,57201010,IT 서비스 및 컨설팅
1039,2492,Infomart Corp,57201010,IT 서비스 및 컨설팅
1040,3632,Gree Inc,57201030,온라인 서비스
1041,5011,Nichireki Group Co Ltd,52201020,건설 및 엔지니어링
1042,7806,MTG Co Ltd,54201020,개인 생활 필수 용품
1043,1939,Yondenko Corp,52201020,건설 및 엔지니어링
1044,1720,Tokyu Construction Co Ltd,52201020,건설 및 엔지니어링
1045,1884,Nippon Road Co Ltd,52201020,건설 및 엔지니어링
1046,1976,Meisei Industrial Co Ltd,52201020,건설 및 엔지니어링
1047,6419,Mars Group Holdings Corp,53301030,카지노 및 도박
1048,3844,Comture Corp,57201010,IT 서비스 및 컨설팅
1049,6929,Nippon Ceramic Co Ltd,57104010,전자 장비 및 부품
1050,8771,eGuarantee Inc,55101050,기업 금융 서비스
1051,9828,Genki Global Dining Concepts Corp,53301020,레스토랑 및 바
1052,3733,Software Service Inc,57201010,IT 서비스 및 컨설팅
1053,6196,Strike Co Ltd,52203040,경영 지원 서비스
1054,3636,Mitsubishi Research Institute Inc,57201010,IT 서비스 및 컨설팅
1055,7085,Curves Holdings Co Ltd,53301040,여가 및 오락시설
1056,9279,GIFT Holdings Inc,53301020,레스토랑 및 바
1057,7606,United Arrows Ltd,53403040,의류 및 액세서리 소매
1058,1775,Fuji Furukawa Engineering & Construction Co Ltd,52201020,건설 및 엔지니어링
1059,3350,Metaplanet Inc,57201010,IT 서비스 및 컨설팅
1060,7184,First Bank of Toyama Ltd,55101010,은행
1061,4825,Weathernews Inc,52203040,경영 지원 서비스
1062,2613,J-Oil Mills Inc,54102020,식품 가공
1063,3950,Pack Corp,51302020,종이 포장재
1064,3539,JM Holdings Co Ltd,54301020,식품 소매 및 유통
1065,6287,Sato Holdings Corp,57105010,사무기기
1066,4384,Raksul Inc,57201030,온라인 서비스
1067,3302,Teikoku Sen-I Co Ltd,53202010,직물 및 가죽제품
1068,9997,Belluna Co Ltd,53402010,백화점
1069,4592,SanBio Co Ltd,56202010,생명 공학 및 의학 연구
1070,1515,Nittetsu Mining Co Ltd,51201050,특수 채굴 및 금속
1071,8037,Kamei Corp,50102030,"오일, 가스 정제 및 마케팅"
1072,8897,Mirarth Holdings Inc,60101010,"부동산 임대, 개발 및 운영"
1073,4071,Plus Alpha Consulting Co Ltd,57201010,IT 서비스 및 컨설팅
1074,6777,Santec Holdings Corp,57104010,전자 장비 및 부품
1075,6745,Hochiki Corp,52203060,비즈니스 지원 용품
1076,6332,Tsukishima Holdings Co Ltd,52102010,산업용 기계 및 장비
1077,7868,Kosaido Holdings Co Ltd,52203020,상업 인쇄 서비스
1078,6376,Nikkiso Co Ltd,52102010,산업용 기계 및 장비
1079,7172,Japan Investment Adviser Co Ltd,55101050,기업 금융 서비스
1080,9438,MTI Ltd,57201030,온라인 서비스
1081,5726,Osaka Titanium Technologies Co Ltd,51201050,특수 채굴 및 금속
1082,3001,Katakura Industries Co Ltd,56201040,제약
1083,8057,Uchida Yoko Co Ltd,52203060,비즈니스 지원 용품
1084,8346,Toho Bank Ltd,55101010,은행
1085,4212,Sekisui Jushi Corp,53203020,건설 자재 및 비품
1086,5727,Toho Titanium Co Ltd,51201050,특수 채굴 및 금속
1087,5970,G-Tekt Corp,53101020,"자동차, 트럭 및 오토바이 부품"
1088,7860,Avex Inc,53302030,엔터테인먼트 제작
1089,8877,Eslead Corp,60101010,"부동산 임대, 개발 및 운영"
1090,2211,Fujiya Co Ltd,54102020,식품 가공
1091,7388,FP Partner Inc,55301010,복합보험 및 중개인
1092,4008,Sumitomo Seika Chemicals Co Ltd,51101010,상품 화학
1093,6209,NPR-Riken Corp,53101020,"자동차, 트럭 및 오토바이 부품"
1094,3465,Ki-Star Real Estate Co Ltd,60101010,"부동산 임대, 개발 및 운영"
1095,8173,Joshin Denki Co Ltd,53403050,컴퓨터 및 전자 제품 소매
1096,6101,Tsugami Corp,52102010,산업용 기계 및 장비
1097,9536,Saibu Gas Holdings Co Ltd,59102010,천연가스 유틸리티
1098,7958,Tenma Corp,51101010,상품 화학
1099,6908,Iriso Electronics Co Ltd,52102030,전기 부품 및 장비
1100,2805,S&B Foods Inc,54102020,식품 가공
1101,9928,Miroku Jyoho Service Co Ltd,57201020,소프트웨어
1102,3612,World Co Ltd,53403040,의류 및 액세서리 소매
1103,4971,MEC Co Ltd,51101030,특수 화학제
1104,9416,Vision Inc,57401010,통합 통신 서비스
1105,5410,Godo Steel Ltd,51201020,철 및 강철
1106,5946,Chofu Seisakusho Co Ltd,53204030,"가전제품, 도구 및 가정 용품"
1107,1870,Yahagi Construction Co Ltd,52201020,건설 및 엔지니어링
1108,7818,Transaction Co Ltd,54201010,가정용 제품
1109,6237,Iwaki Co Ltd,52102010,산업용 기계 및 장비
1110,9310,Japan Transcity Corp,52405030,지상 화물 및 물류
1111,8613,Marusan Securities Co Ltd,55102010,투자 은행 및 중개 서비스
1112,3608,TSI Holdings Co Ltd,53202020,의류 및 액세서리
1113,5461,Chubu Steel Plate Co Ltd,51201020,철 및 강철
1114,6914,Optex Group Co Ltd,52102030,전기 부품 및 장비
1115,5715,Furukawa Co Ltd,51201050,특수 채굴 및 금속
1116,8159,Tachibana Eletech Co Ltd,52102030,전기 부품 및 장비
1117,9621,CTI Engineering Co Ltd,52201020,건설 및 엔지니어링
1118,7342,WealthNavi Inc,57301010,핀테크
1119,8894,Revolution Co Ltd,60101020,부동산 서비스
1120,6027,Bengo4.com Inc,57201030,온라인 서비스
1121,7508,G-7 Holdings Inc,54301020,식품 소매 및 유통
1122,2208,Bourbon Corp,54102020,식품 가공
1123,4326,Intage Holdings Inc,53302010,광고 및 마케팅
1124,3817,SRA Holdings Inc,57201010,IT 서비스 및 컨설팅
1125,4886,ASKA Pharmaceutical Holdings Co Ltd,56201040,제약
1126,7942,JSP Corp,51101010,상품 화학
1127,7721,Tokyo Keiki Inc,52102010,산업용 기계 및 장비
1128,2170,Link and Motivation Inc,52203030,고용 서비스
1129,3673,Broadleaf Co Ltd,57201020,소프트웨어
1130,6859,Espec Corp,52102010,산업용 기계 및 장비
1131,5851,Ryobi Ltd,53101020,"자동차, 트럭 및 오토바이 부품"
1132,1882,Toa Road Corp,52201020,건설 및 엔지니어링
1133,7287,Nippon Seiki Co Ltd,53101020,"자동차, 트럭 및 오토바이 부품"
1134,7292,Murakami Corp,53101020,"자동차, 트럭 및 오토바이 부품"
1135,4687,TDC Soft Inc,57201010,IT 서비스 및 컨설팅
1136,2003,Nitto Fuji Flour Milling Co Ltd,54102020,식품 가공
1137,5889,Japan Eyewear Holdings Co Ltd,56101020,"의료 장비, 물품 및 유통"
1138,5982,Maruzen Co Ltd,52102010,산업용 기계 및 장비
1139,3150,Gremz Inc,52203010,환경 서비스 및 장비
1140,5027,AnyMind Group Inc,53302010,광고 및 마케팅
1141,9755,Oyo Corp,52201020,건설 및 엔지니어링
1142,4362,Nippon Fine Chemical Co Ltd,51101030,특수 화학제
1143,6349,Komori Corp,52102010,산업용 기계 및 장비
1144,6741,Nippon Signal Co Ltd,57102010,통신 및 네트워킹
1145,4187,Osaka Organic Chemical Industry Ltd,51101010,상품 화학
1146,6381,Anest Iwata Corp,52102010,산업용 기계 및 장비
1147,5480,Nippon Yakin Kogyo Co Ltd,51201020,철 및 강철
1148,4431,Smaregi Inc,57201020,소프트웨어
1149,3151,Vital Ksk Holdings Inc,56201040,제약
1150,2664,Cawachi Ltd,54301010,의약품 소매
1151,3290,One REIT Inc,60102020,상업용 REITs
1152,3668,Colopl Inc,57201030,온라인 서비스
1153,5445,Tokyo Tekko Co Ltd,51201020,철 및 강철
1154,7239,Tachi-S Co Ltd,53101020,"자동차, 트럭 및 오토바이 부품"
1155,8160,Kisoji Co Ltd,53301020,레스토랑 및 바
1156,7995,Valqua Ltd,52102010,산업용 기계 및 장비
1157,8182,Inageya Co Ltd,54301020,식품 소매 및 유통
1158,4220,Riken Technos Corp,51101010,상품 화학
1159,4298,Proto Corp,53302040,소비자 출판
1160,2395,Shin Nippon Biomedical Laboratories Ltd,56202010,생명 공학 및 의학 연구
1161,2752,Fujio Food Group Inc,53301020,레스토랑 및 바
1162,7279,Hi-Lex Corp,53101020,"자동차, 트럭 및 오토바이 부품"
1163,3964,Aucnet Inc,57201030,온라인 서비스
1164,2790,Nafco Co Ltd,53403020,주택 개조 제품 및 서비스 소매
1165,1821,Sumitomo Mitsui Construction Co Ltd,52201020,건설 및 엔지니어링
1166,9161,Integrated Design & Engineering Holdings Co Ltd,52201020,건설 및 엔지니어링
1167,1822,Daiho Corp,52201020,건설 및 엔지니어링
1168,9070,Tonami Holdings Co Ltd,52405030,지상 화물 및 물류
1169,2931,Euglena Co Ltd,54102020,식품 가공
1170,4917,Mandom Corp,54201020,개인 생활 필수 용품
1171,8200,Ringer Hut Co Ltd,53301020,레스토랑 및 바
1172,7130,Yamae Group Holdings Co Ltd,54301020,식품 소매 및 유통
1173,6328,Ebara Jitsugyo Co Ltd,52203010,환경 서비스 및 장비
1174,25935,Ito En Prf Shs,54101030,무알콜 음료
1175,9348,ispace Inc,52101010,항공우주 및 방위
1176,6277,Hosokawa Micron Corp,52102010,산업용 기계 및 장비
1177,2681,Geo Holdings Corp,53403090,기타 전문 소매
1178,6517,Denyo Co Ltd,52102040,중전기장비
1179,8061,Seika Corp,52102010,산업용 기계 및 장비
1180,3371,Softcreate Holdings Corp,57201010,IT 서비스 및 컨설팅
1181,4997,Nihon Nohyaku Co Ltd,51101020,농화학제
1182,7241,Futaba Industrial Co Ltd,53101020,"자동차, 트럭 및 오토바이 부품"
1183,8360,Yamanashi Chuo Bank Ltd,55101010,은행
1184,1379,Hokuto Corp,54102010,어업 및 농업
1185,8167,Retail Partners Co Ltd,54301020,식품 소매 및 유통
1186,5290,Vertex Corp,51202010,건설 자재
1187,4343,Aeon Fantasy Co Ltd,53301040,여가 및 오락시설
1188,9790,Fukui Computer Holdings Inc,57201020,소프트웨어
1189,1898,Seikitokyu Kogyo Co Ltd,52201020,건설 및 엔지니어링
1190,8508,J Trust Co Ltd,55101030,소비자 대출
1191,3480,J.S.B. Co Ltd,60101010,"부동산 임대, 개발 및 운영"
1192,197A,Tauns Laboratories Inc,56101020,"의료 장비, 물품 및 유통"
1193,4028,Ishihara Sangyo Kaisha Ltd,51101090,다각적 화학 산업
1194,8841,TOC Co Ltd,60101010,"부동산 임대, 개발 및 운영"
1195,4641,Altech Corp,52203030,고용 서비스
1196,6941,Yamaichi Electronics Co Ltd,57101020,반도체 장비 및 테스트
1197,3679,ZIGExN Co Ltd,57201030,온라인 서비스
1198,7613,SIIX Corp,57104010,전자 장비 및 부품
1199,2749,JP-Holdings Inc,54201030,개인 서비스
1200,7685,BuySell Technologies Co Ltd,53403090,기타 전문 소매
1201,4481,Base Co Ltd,57201010,IT 서비스 및 컨설팅
1202,4051,GMO Financial Gate Inc,52203040,경영 지원 서비스
1203,3104,Fujibo Holdings Inc,53202010,직물 및 가죽제품
1204,7246,Press Kogyo Co Ltd,53101020,"자동차, 트럭 및 오토바이 부품"
1205,7350,Okinawa Financial Group Inc,55101010,은행
1206,9511,Okinawa Electric Power Co Inc,59101010,전력 유틸리티
1207,7128,Maruka Furusato Corp,52102010,산업용 기계 및 장비
1208,8043,Starzen Co Ltd,54102020,식품 가공
1209,5595,Institute for Q-shu Pioneers of Space Inc,52101010,항공우주 및 방위
1210,4674,Cresco Ltd,57201020,소프트웨어
1211,6258,Hirata Corp,52102010,산업용 기계 및 장비
1212,8707,IwaiCosmo Holdings Inc,55102010,투자 은행 및 중개 서비스
1213,7745,A&D Holon Holdings Co Ltd,52102010,산업용 기계 및 장비
1214,4765,SBI Global Asset Management Co Ltd,55102020,투자 관리 및 펀드 운영
1215,3091,Bronco Billy Co Ltd,53301020,레스토랑 및 바
1216,8739,Sparx Group Co Ltd,55102020,투자 관리 및 펀드 운영
1217,6151,Nitto Kohki Co Ltd,52102010,산업용 기계 및 장비
1218,6640,I-PEX Inc,57104010,전자 장비 및 부품
1219,3034,Qol Holdings Co Ltd,54301010,의약품 소매
1220,7593,VT Holdings Co Ltd,53403010,"자동차 차량, 부품 및 서비스 소매"
1221,4047,Kanto Denka Kogyo Co Ltd,51101010,상품 화학
1222,9733,Nagase Brothers Inc,63103010,전문 및 비즈니스 교육
1223,9661,Kabuki-Za Co Ltd,60101010,"부동산 임대, 개발 및 운영"
1224,2980,SRE Holdings Corp,60101020,부동산 서비스
1225,2734,Sala Corp,50102030,"오일, 가스 정제 및 마케팅"
1226,6961,Enplas Corp,57101010,반도체
1227,3395,Saint Marc Holdings Co Ltd,53301020,레스토랑 및 바
1228,4848,Fullcast Holdings Co Ltd,52203030,고용 서비스
1229,2698,Can Do Co Ltd,54301020,식품 소매 및 유통
1230,8075,Shinsho Corp,51201020,철 및 강철
1231,4923,Cota Co Ltd,54201020,개인 생활 필수 용품
1232,1786,Oriental Shiraishi Corp,52201020,건설 및 엔지니어링
1233,9946,Ministop Co Ltd,54301020,식품 소매 및 유통
1234,3540,CI Medical Co Ltd,56101020,"의료 장비, 물품 및 유통"
1235,4116,Dainichiseika Color & Chemicals MFG Co Ltd,51101030,특수 화학제
1236,4970,Toyo Gosei Co Ltd,51101030,특수 화학제
1237,6339,Sintokogio Ltd,52102010,산업용 기계 및 장비
1238,3431,Miyaji Engineering Group Inc,52201020,건설 및 엔지니어링
1239,6118,Aida Engineering Ltd,52102010,산업용 기계 및 장비
1240,1852,Asanuma Corp,52201020,건설 및 엔지니어링
1241,8185,Chiyoda Co Ltd,53403040,의류 및 액세서리 소매
1242,8084,Ryoden Corp,52102030,전기 부품 및 장비
1243,4475,Hennge KK,57201010,IT 서비스 및 컨설팅
1244,3479,TKP Corp,60101010,"부동산 임대, 개발 및 운영"
1245,1965,Techno Ryowa Ltd,52201020,건설 및 엔지니어링
1246,8715,Anicom Holdings Inc,55301020,손해보험
1247,9158,CUC Inc,56102010,의료 시설 및 서비스
1248,5602,Kurimoto Ltd,51201020,철 및 강철
1249,3232,Mie Kotsu Group Holdings Inc,60101010,"부동산 임대, 개발 및 운영"
1250,8393,Miyazaki Bank Ltd,55101010,은행
1251,8281,Xebio Holdings Co Ltd,53403090,기타 전문 소매
1252,9900,Sagami Holdings Corp,53301020,레스토랑 및 바
1253,7749,Medikit Co Ltd,56101020,"의료 장비, 물품 및 유통"
1254,7322,San Ju San Financial Group Inc,55101010,은행
1255,3482,Loadstar Capital KK,60101020,부동산 서비스
1256,4813,Access Co Ltd,57201020,소프트웨어
1257,8392,Oita Bank Ltd,55101010,은행
1258,6718,Aiphone Co Ltd,57102010,통신 및 네트워킹
1259,2874,Yokorei Co Ltd,54102020,식품 가공
1260,3661,M-up Holdings Inc,57201030,온라인 서비스
1261,3687,Fixstars Corp,57201020,소프트웨어
1262,4165,Plaid Inc,57201010,IT 서비스 및 컨설팅
1263,7384,Procrea Holdings Inc,55101010,은행
1264,9399,Beat Holdings Ltd,55102020,투자 관리 및 펀드 운영
1265,1514,Sumiseki Holdings Inc,50101010,석탄
1266,2908,Fujicco Co Ltd,54102020,식품 가공
1267,6364,Hokuetsu Industries Co Ltd,52102010,산업용 기계 및 장비
1268,2226,Koike-Ya Inc,54102020,식품 가공
1269,4109,Stella Chemifa Corp,51101030,특수 화학제
1270,5184,Nichirin Co Ltd,53101020,"자동차, 트럭 및 오토바이 부품"
1271,7088,Forum Engineering Inc,52203030,고용 서비스
1272,6957,Shibaura Electronics Co Ltd,57104010,전자 장비 및 부품
