,Symbol,Name,IndustryCode,Industry
0,7203,Toyota Motor Corp,53101010,자동차 및 트럭 제조
1,8306,Mitsubishi UFJ Financial Group Inc,55101010,은행
2,6501,Hitachi Ltd,54401010,소비재 대기업
3,6758,Sony Group Corp,57106030,가정용 전자 제품
4,6098,Recruit Holdings Co Ltd,52203030,고용 서비스
5,9983,Fast Retailing Co Ltd,53403040,의류 및 액세서리 소매
6,6861,Keyence Corp,57104010,전자 장비 및 부품
7,8316,Sumitomo Mitsui Financial Group Inc,55101010,은행
8,9432,Nippon Telegraph and Telephone Corp,57401010,통합 통신 서비스
9,9984,SoftBank Group Corp,57401020,무선 통신 서비스
10,8001,Itochu Corp,52202010,다각적 산업용 제품 도매
11,4519,Chugai Pharmaceutical Co Ltd,56201040,제약
12,8766,Tokio Marine Holdings Inc,55301020,손해보험
13,4063,Shin-Etsu Chemical Co Ltd,51101090,다각적 화학 산업
14,9433,KDDI Corp,57401020,무선 통신 서비스
15,8058,Mitsubishi Corp,52202010,다각적 산업용 제품 도매
16,7974,Nintendo Co Ltd,53205010,장난감 및 어린이 제품
17,8035,Tokyo Electron Ltd,57101020,반도체 장비 및 테스트
18,8031,Mitsui & Co Ltd,52202010,다각적 산업용 제품 도매
19,8411,Mizuho Financial Group Inc,55101010,은행
20,9434,SoftBank Corp,57401020,무선 통신 서비스
21,4568,Daiichi Sankyo Co Ltd,56201040,제약
22,2914,Japan Tobacco Inc,54102030,담배
23,7011,Mitsubishi Heavy Industries Ltd,54401010,소비재 대기업
24,6902,Denso Corp,53101020,"자동차, 트럭 및 오토바이 부품"
25,7267,Honda Motor Co Ltd,53101010,자동차 및 트럭 제조
26,6857,Advantest Corp,57101020,반도체 장비 및 테스트
27,7741,Hoya Corp,56101020,"의료 장비, 물품 및 유통"
28,4502,Takeda Pharmaceutical Co Ltd,56201040,제약
29,7751,Canon Inc,57105010,사무기기
30,4661,Oriental Land Co Ltd,53301040,여가 및 오락시설
31,3382,Seven & i Holdings Co Ltd,54301020,식품 소매 및 유통
32,6702,Fujitsu Ltd,57201010,IT 서비스 및 컨설팅
33,8725,MS&AD Insurance Group Holdings Inc,55301020,손해보험
34,6503,Mitsubishi Electric Corp,54401010,소비재 대기업
35,6367,Daikin Industries Ltd,52102030,전기 부품 및 장비
36,7182,Japan Post Bank Co Ltd,55101010,은행
37,6981,Murata Manufacturing Co Ltd,57104010,전자 장비 및 부품
38,4578,Otsuka Holdings Co Ltd,56201040,제약
39,6178,Japan Post Holdings Co Ltd,55301030,생명 및 건강 보험
40,6146,Disco Corp,57101020,반도체 장비 및 테스트
41,4543,Terumo Corp,56101020,"의료 장비, 물품 및 유통"
42,6273,SMC Corp,52102010,산업용 기계 및 장비
43,4901,Fujifilm Holdings Corp,51101030,특수 화학제
44,6954,Fanuc Corp,52102010,산업용 기계 및 장비
45,8591,ORIX Corp,55101030,소비자 대출
46,8002,Marubeni Corp,52202010,다각적 산업용 제품 도매
47,8053,Sumitomo Corp,52202010,다각적 산업용 제품 도매
48,6301,Komatsu Ltd,52102020,중장비 및 차량
49,5108,Bridgestone Corp,53101030,타이어 및 고무 제품
50,6762,TDK Corp,52102030,전기 부품 및 장비
51,6723,Renesas Electronics Corp,57101010,반도체
52,9613,NTT Data Group Corp,57201010,IT 서비스 및 컨설팅
53,8750,Dai-ichi Life Holdings Inc,55301030,생명 및 건강 보험
54,6201,Toyota Industries Corp,52102020,중장비 및 차량
55,8801,Mitsui Fudosan Co Ltd,60101010,"부동산 임대, 개발 및 운영"
56,6752,Panasonic Holdings Corp,57106030,가정용 전자 제품
57,6701,NEC Corp,57201010,IT 서비스 및 컨설팅
58,8630,Sompo Holdings Inc,55301020,손해보험
59,6594,Nidec Corp,52102030,전기 부품 및 장비
60,5401,Nippon Steel Corp,51201020,철 및 강철
61,9020,East Japan Railway Co,52406020,지상 및 해상 여객 운송
62,8267,Aeon Co Ltd,54301020,식품 소매 및 유통
63,9022,Central Japan Railway Co,52406020,지상 및 해상 여객 운송
64,2802,Ajinomoto Co Inc,54102020,식품 가공
65,7269,Suzuki Motor Corp,53101010,자동차 및 트럭 제조
66,1925,Daiwa House Industry Co Ltd,53203010,주택 건설
67,4503,Astellas Pharma Inc,56201040,제약
68,7733,Olympus Corp,56101010,첨단 의료 장비 및 기술
69,4452,Kao Corp,54201020,개인 생활 필수 용품
70,4689,LY Corp,57201030,온라인 서비스
71,8015,Toyota Tsusho Corp,52202010,다각적 산업용 제품 도매
72,8604,Nomura Holdings Inc,55102010,투자 은행 및 중개 서비스
73,8308,Resona Holdings Inc,55101010,은행
74,8802,Mitsubishi Estate Co Ltd,60101010,"부동산 임대, 개발 및 운영"
75,4307,Nomura Research Institute Ltd,57201010,IT 서비스 및 컨설팅
76,8309,Sumitomo Mitsui Trust Group Inc,55101010,은행
77,1605,Inpex Corp,50102020,"오일, 가스 탐사 및 생산"
78,2502,Asahi Group Holdings Ltd,54101010,양조업
79,4684,Obic Co Ltd,57201010,IT 서비스 및 컨설팅
80,8113,Unicharm Corp,54201020,개인 생활 필수 용품
81,9735,Secom Co Ltd,52203040,경영 지원 서비스
82,5020,ENEOS Holdings Inc,50102030,"오일, 가스 정제 및 마케팅"
83,1928,Sekisui House Ltd,53203010,주택 건설
84,7532,Pan Pacific International Holdings Corp,53402020,할인점
85,4612,Nippon Paint Holdings Co Ltd,51101010,상품 화학
86,6326,Kubota Corp,52102020,중장비 및 차량
87,9101,Nippon Yusen KK,52405020,해양 화물 및 물류
88,5802,Sumitomo Electric Industries Ltd,53101020,"자동차, 트럭 및 오토바이 부품"
89,6971,Kyocera Corp,57104010,전자 장비 및 부품
90,8830,Sumitomo Realty & Development Co Ltd,60101010,"부동산 임대, 개발 및 운영"
91,7832,Bandai Namco Holdings Inc,53205010,장난감 및 어린이 제품
92,9766,Konami Group Corp,57201020,소프트웨어
93,7936,Asics Corp,53202030,제화
94,9843,Nitori Holdings Co Ltd,53403030,가정용 가구 소매
95,9104,Mitsui O.S.K. Lines Ltd,52405020,해양 화물 및 물류
96,4755,Rakuten Group Inc,57201030,온라인 서비스
97,2503,Kirin Holdings Co Ltd,54101010,양조업
98,6869,Sysmex Corp,56101020,"의료 장비, 물품 및 유통"
99,4091,Nippon Sanso Holdings Corp,51101010,상품 화학
100,4716,Oracle Corp Japan,57201020,소프트웨어
101,9697,Capcom Co Ltd,57201020,소프트웨어
102,4507,Shionogi & Co Ltd,56201040,제약
103,7309,Shimano Inc,53205020,오락용 제품
104,8697,Japan Exchange Group Inc,55102050,"금융, 상품 시장 운영 및 서비스 제공"
105,9503,Kansai Electric Power Co Inc,59101010,전력 유틸리티
106,7270,Subaru Corp,53101010,자동차 및 트럭 제조
107,6988,Nitto Denko Corp,51101030,특수 화학제
108,6920,Lasertec Corp,57101020,반도체 장비 및 테스트
109,3659,Nexon Co Ltd,57201030,온라인 서비스
110,2801,Kikkoman Corp,54102020,식품 가공
111,5803,Fujikura Ltd,52102030,전기 부품 및 장비
112,8601,Daiwa Securities Group Inc,55102010,투자 은행 및 중개 서비스
113,7201,Nissan Motor Co Ltd,53101010,자동차 및 트럭 제조
114,2587,Suntory Beverage & Food Ltd,54101030,무알콜 음료
115,3407,Asahi Kasei Corp,51101090,다각적 화학 산업
116,8593,Mitsubishi HC Capital Inc,55101050,기업 금융 서비스
117,4523,Eisai Co Ltd,56201040,제약
118,1802,Obayashi Corp,52201020,건설 및 엔지니어링
119,3402,Toray Industries Inc,51101010,상품 화학
120,9531,Tokyo Gas Co Ltd,59102010,천연가스 유틸리티
121,7202,Isuzu Motors Ltd,53101010,자동차 및 트럭 제조
122,1812,Kajima Corp,52201020,건설 및 엔지니어링
123,9435,Hikari Tsushin Inc,57102010,통신 및 네트워킹
124,3092,ZOZO Inc,53403040,의류 및 액세서리 소매
125,9107,Kawasaki Kisen Kaisha Ltd,52405020,해양 화물 및 물류
126,5019,Idemitsu Kosan Co Ltd,50102030,"오일, 가스 정제 및 마케팅"
127,7013,IHI Corp,52102010,산업용 기계 및 장비
128,7272,Yamaha Motor Co Ltd,53101010,자동차 및 트럭 제조
129,4768,Otsuka Corp,57201010,IT 서비스 및 컨설팅
130,9202,ANA Holdings Inc,52406010,항공사
131,7912,Dai Nippon Printing Co Ltd,52203020,상업 인쇄 서비스
132,4151,Kyowa Kirin Co Ltd,56201040,제약
133,8795,T&D Holdings Inc,55301030,생명 및 건강 보험
134,9532,Osaka Gas Co Ltd,59102010,천연가스 유틸리티
135,7911,TOPPAN Holdings Inc,52203020,상업 인쇄 서비스
136,7550,Zensho Holdings Co Ltd,53301020,레스토랑 및 바
137,7259,Aisin Corp,53101020,"자동차, 트럭 및 오토바이 부품"
138,9021,West Japan Railway Co,52406020,지상 및 해상 여객 운송
139,7701,Shimadzu Corp,57105010,사무기기
140,9502,Chubu Electric Power Co Inc,59101010,전력 유틸리티
141,6504,Fuji Electric Co Ltd,52102030,전기 부품 및 장비
142,6586,Makita Corp,52102010,산업용 기계 및 장비
143,3064,MonotaRO Co Ltd,53402010,백화점
144,4188,Mitsubishi Chemical Group Corp,51101090,다각적 화학 산업
145,6383,Daifuku Co Ltd,52102040,중전기장비
146,1801,Taisei Corp,52201020,건설 및 엔지니어링
147,9005,Tokyu Corp,52406020,지상 및 해상 여객 운송
148,8136,Sanrio Co Ltd,53403090,기타 전문 소매
149,1878,Daito Trust Construction Co Ltd,60101010,"부동산 임대, 개발 및 운영"
150,2897,Nissin Foods Holdings Co Ltd,54102020,식품 가공
151,9024,Seibu Holdings Inc,52406020,지상 및 해상 여객 운송
152,7181,Japan Post Insurance Co Ltd,55301030,생명 및 건강 보험
153,4704,Trend Micro Inc,57201020,소프트웨어
154,2875,Toyo Suisan Kaisha Ltd,54102020,식품 가공
155,1911,Sumitomo Forestry Co Ltd,53203010,주택 건설
156,8729,Sony Financial Holdings Inc,55301030,생명 및 건강 보험
157,5411,JFE Holdings Inc,51201020,철 및 강철
158,9602,Toho Co Ltd (Tokyo),53302030,엔터테인먼트 제작
159,4911,Shiseido Co Ltd,54201020,개인 생활 필수 용품
160,6506,Yaskawa Electric Corp,52102030,전기 부품 및 장비
161,3003,Hulic Co Ltd,60101010,"부동산 임대, 개발 및 운영"
162,8951,Nippon Building Fund Inc,60102020,상업용 REITs
163,4324,Dentsu Group Inc,53302010,광고 및 마케팅
164,7012,Kawasaki Heavy Industries Ltd,54401010,소비재 대기업
165,5713,Sumitomo Metal Mining Co Ltd,51201050,특수 채굴 및 금속
166,6361,Ebara Corp,52102010,산업용 기계 및 장비
167,9201,Japan Airlines Co Ltd,52406010,항공사
168,6645,Omron Corp,52102030,전기 부품 및 장비
169,4204,Sekisui Chemical Co Ltd,53203010,주택 건설
170,6479,Minebea Mitsumi Inc,57104010,전자 장비 및 부품
171,8473,SBI Holdings Inc,55102030,다각적 투자 서비스
172,7186,Concordia Financial Group Ltd,55101010,은행
173,6724,Seiko Epson Corp,57106010,컴퓨터 하드웨어
174,5201,AGC Inc,53203020,건설 자재 및 비품
175,2267,Yakult Honsha Co Ltd,54102020,식품 가공
176,9042,Hankyu Hanshin Holdings Inc,52406020,지상 및 해상 여객 운송
177,5929,Sanwa Holdings Corp,53203020,건설 자재 및 비품
178,9023,Tokyo Metro Co Ltd,52406020,지상 및 해상 여객 운송
179,3038,Kobe Bussan Co Ltd,54301020,식품 소매 및 유통
180,8331,Chiba Bank Ltd,55101010,은행
181,7752,Ricoh Co Ltd,57105010,사무기기
182,7735,Screen Holdings Co Ltd,57101020,반도체 장비 및 테스트
183,2269,Meiji Holdings Co Ltd,54102020,식품 가공
184,6841,Yokogawa Electric Corp,52102010,산업용 기계 및 장비
185,5334,Niterra Co Ltd,53101020,"자동차, 트럭 및 오토바이 부품"
186,9501,Tokyo Electric Power Company Holdings Inc,59101010,전력 유틸리티
187,9143,SG Holdings Co Ltd,52405010,"배달, 우편, 항공 화물 및 육상 물류"
188,9719,SCSK Corp,57201010,IT 서비스 및 컨설팅
189,3626,TIS Inc,57201010,IT 서비스 및 컨설팅
190,4528,Ono Pharmaceutical Co Ltd,56201040,제약
191,6532,BayCurrent Inc,52203040,경영 지원 서비스
192,1803,Shimizu Corp,52201020,건설 및 엔지니어링
193,3099,Isetan Mitsukoshi Holdings Ltd,53402010,백화점
194,3088,MatsukiyoCocokara & Co,54301010,의약품 소매
195,2413,M3 Inc,57201030,온라인 서비스
196,6465,Hoshizaki Corp,52102010,산업용 기계 및 장비
197,2702,McDonald's Holdings Company Japan Ltd,53301020,레스토랑 및 바
198,8354,Fukuoka Financial Group Inc,55101010,은행
199,2327,NS Solutions Corp,57201010,IT 서비스 및 컨설팅
200,5831,Shizuoka Financial Group Inc,55101010,은행
201,7453,Ryohin Keikaku Co Ltd,53402010,백화점
202,8952,Japan Real Estate Investment Corp,60102020,상업용 REITs
203,1773,YTL Corporation Bhd,59104010,복합 유틸리티
204,2670,ABC-Mart Inc,53403040,의류 및 액세서리 소매
205,4021,Nissan Chemical Corp,51101090,다각적 화학 산업
206,4816,Toei Animation Co Ltd,53302030,엔터테인먼트 제작
207,6370,Kurita Water Industries Ltd,52203010,환경 서비스 및 장비
208,9508,Kyushu Electric Power Co Inc,59101010,전력 유틸리티
209,6305,Hitachi Construction Machinery Co Ltd,52102020,중장비 및 차량
210,6967,Shinko Electric Industries Co Ltd,57101010,반도체
211,8439,Tokyo Century Corp,55101050,기업 금융 서비스
212,9962,Misumi Group Inc,52102010,산업용 기계 및 장비
213,3405,Kuraray Co Ltd,51101010,상품 화학
214,6845,Azbil Corp,52102030,전기 부품 및 장비
215,5332,TOTO Ltd,53203020,건설 자재 및 비품
216,4004,Resonac Holdings Corp,51101010,상품 화학
217,7747,Asahi Intecc Co Ltd,56101020,"의료 장비, 물품 및 유통"
218,5844,Kyoto Financial Group Inc,55101010,은행
219,3283,Nippon Prologis REIT Inc,60102020,상업용 REITs
220,5838,Rakuten Bank Ltd,55101010,은행
221,9009,Keisei Electric Railway Co Ltd,52406020,지상 및 해상 여객 운송
222,3231,Nomura Real Estate Holdings Inc,60101010,"부동산 임대, 개발 및 운영"
223,2768,Sojitz Corp,52202010,다각적 산업용 제품 도매
224,3289,Tokyu Fudosan Holdings Corp,60101010,"부동산 임대, 개발 및 운영"
225,4732,USS Co Ltd,57201030,온라인 서비스
226,6448,Brother Industries Ltd,57105010,사무기기
227,9684,Square Enix Holdings Co Ltd,57201030,온라인 서비스
228,4183,Mitsui Chemicals Inc,51101010,상품 화학
229,7211,Mitsubishi Motors Corp,53101010,자동차 및 트럭 제조
230,4062,Ibiden Co Ltd,57101010,반도체
231,7167,Mebuki Financial Group Inc,55101010,은행
232,4042,Tosoh Corp,51101090,다각적 화학 산업
233,3288,Open House Group Co Ltd,60101010,"부동산 임대, 개발 및 운영"
234,3462,Nomura Real Estate Master Fund Inc,60102010,복합부동산 REITs
235,8953,Japan Metropolitan Fund Investment Corp,60102020,상업용 REITs
236,6753,Sharp Corp,57106030,가정용 전자 제품
237,7731,Nikon Corp,57106030,가정용 전자 제품
238,9041,Kintetsu Group Holdings Co Ltd,52406020,지상 및 해상 여객 운송
239,8253,Credit Saison Co Ltd,55101030,소비자 대출
240,9506,Tohoku Electric Power Co Inc,59101010,전력 유틸리티
241,1944,Kinden Corp,52201020,건설 및 엔지니어링
242,4527,Rohto Pharmaceutical Co Ltd,56201040,제약
243,7261,Mazda Motor Corp,53101010,자동차 및 트럭 제조
244,2212,Yamazaki Baking Co Ltd,54102020,식품 가공
245,5406,Kobe Steel Ltd,51201020,철 및 강철
246,6806,Hirose Electric Co Ltd,57104010,전자 장비 및 부품
247,9147,Nippon Express Holdings Inc,52405010,"배달, 우편, 항공 화물 및 육상 물류"
248,3281,GLP J-REIT,60102020,상업용 REITs
249,9401,TBS Holdings Inc,53302020,방송
250,4005,Sumitomo Chemical Co Ltd,51101090,다각적 화학 산업
251,3291,Iida Group Holdings Co Ltd,60101010,"부동산 임대, 개발 및 운영"
252,5333,NGK Insulators Ltd,52102010,산업용 기계 및 장비
253,6460,Sega Sammy Holdings Inc,53302030,엔터테인먼트 제작
254,2501,Sapporo Holdings Ltd,54101010,양조업
255,4536,Santen Pharmaceutical Co Ltd,56201040,제약
256,9749,Fuji Soft Inc,57201010,IT 서비스 및 컨설팅
257,9142,Kyushu Railway Co,52406020,지상 및 해상 여객 운송
258,4182,Mitsubishi Gas Chemical Co Inc,51101010,상품 화학
259,9404,Nippon Television Holdings Inc,53302020,방송
260,8972,KDX Realty Investment Corp,60102010,복합부동산 REITs
261,8227,Shimamura Co Ltd,53403040,의류 및 액세서리 소매
262,9007,Odakyu Electric Railway Co Ltd,52406020,지상 및 해상 여객 운송
263,8572,Acom Co Ltd,55101030,소비자 대출
264,7276,Koito Manufacturing Co Ltd,53101020,"자동차, 트럭 및 오토바이 부품"
265,6525,Kokusai Electric Corp,57101020,반도체 장비 및 테스트
266,5021,Cosmo Energy Holdings Co Ltd,50102030,"오일, 가스 정제 및 마케팅"
267,5344,MARUWA Co Ltd,57104010,전자 장비 및 부품
268,6963,Rohm Co Ltd,57101010,반도체
269,9064,Yamato Holdings Co Ltd,52405010,"배달, 우편, 항공 화물 및 육상 물류"
270,7951,Yamaha Corp,53205020,오락용 제품
271,1808,Haseko Corp,53203010,주택 건설
272,3774,Internet Initiative Japan Inc,57401010,통합 통신 서비스
273,3349,Cosmos Pharmaceutical Corp,54301010,의약품 소매
274,4403,NOF Corp,51101010,상품 화학
275,6965,Hamamatsu Photonics KK,57101010,반도체
276,8804,Tokyo Tatemono Co Ltd,60101010,"부동산 임대, 개발 및 운영"
277,3861,Oji Holdings Corp,51301020,종이 제품
278,2002,Nisshin Seifun Group Inc,54102020,식품 가공
279,6417,Sankyo Co Ltd,53301030,카지노 및 도박
280,3635,Koei Tecmo Holdings Co Ltd,57201030,온라인 서비스
281,2331,Sohgo Security Services Co Ltd,52203040,경영 지원 서비스
282,2181,Persol Holdings Co Ltd,52203030,고용 서비스
283,7459,Medipal Holdings Corp,56201040,제약
284,9008,Keio Corp,52406020,지상 및 해상 여객 운송
285,8060,Canon Marketing Japan Inc,57105010,사무기기
286,8984,Daiwa House REIT Investment Corp,60102010,복합부동산 REITs
287,3769,GMO Payment Gateway Inc,52203040,경영 지원 서비스
288,4733,Obic Business Consultants Co Ltd,57201020,소프트웨어
289,9001,Tobu Railway Co Ltd,52406020,지상 및 해상 여객 운송
290,5444,Yamato Kogyo Co Ltd,51201020,철 및 강철
291,2871,Nichirei Corp,54102020,식품 가공
292,2282,NH Foods Ltd,54102020,식품 가공
293,5101,Yokohama Rubber Co Ltd,53101030,타이어 및 고무 제품
294,2809,Kewpie Corp,54102020,식품 가공
295,6113,Amada Co Ltd,52102010,산업용 기계 및 장비
296,3197,Skylark Holdings Co Ltd,53301020,레스토랑 및 바
297,9706,Japan Airport Terminal Co Ltd,52407010,공항 운영 및 서비스
298,8359,Hachijuni Bank Ltd,55101010,은행
299,4751,CyberAgent Inc,53302010,광고 및 마케팅
300,5938,LIXIL Corp,53203020,건설 자재 및 비품
301,1973,NEC Networks & System Integration Corp,57201010,IT 서비스 및 컨설팅
302,8252,Marui Group Co Ltd,55101030,소비자 대출
303,5830,Iyogin Holdings Inc,55101010,은행
304,4912,Lion Corp,54201010,가정용 제품
305,7649,Sugi Holdings Co Ltd,54301010,의약품 소매
306,8963,Invincible Investment Corp,60102010,복합부동산 REITs
307,9513,Electric Power Development Co Ltd,59101010,전력 유틸리티
308,2371,Kakaku.com Inc,57201030,온라인 서비스
309,4186,Tokyo Ohka Kogyo Co Ltd,51101030,특수 화학제
310,1942,Kandenko Co Ltd,52201020,건설 및 엔지니어링
311,6005,Miura Co Ltd,52102010,산업용 기계 및 장비
312,5110,Sumitomo Rubber Industries Ltd,53101030,타이어 및 고무 제품
313,9076,Seino Holdings Co Ltd,52405010,"배달, 우편, 항공 화물 및 육상 물류"
314,5947,Rinnai Corp,53204030,"가전제품, 도구 및 가정 용품"
315,6406,Fujitec Co Ltd,52102040,중전기장비
316,8056,Biprogy Inc,57201010,IT 서비스 및 컨설팅
317,8905,Aeon Mall Co Ltd,60101010,"부동산 임대, 개발 및 운영"
318,2784,Alfresa Holdings Corp,56101020,"의료 장비, 물품 및 유통"
319,3086,J.Front Retailing Co Ltd,53402010,백화점
320,9831,Yamada Holdings Co Ltd,53403050,컴퓨터 및 전자 제품 소매
321,4980,Dexerials Corp,57104010,전자 장비 및 부품
322,5631,Japan Steel Works Ltd,52102010,산업용 기계 및 장비
323,3436,Sumco Corp,57101010,반도체
324,8088,Iwatani Corp,50102030,"오일, 가스 정제 및 마케팅"
325,2433,Hakuhodo DY Holdings Inc,53302010,광고 및 마케팅
326,2579,Coca-Cola Bottlers Japan Holdings Inc,54101030,무알콜 음료
327,8954,Orix JREIT Inc,60102020,상업용 REITs
328,7163,SBI Sumishin Net Bank Ltd,55101010,은행
329,6481,THK Co Ltd,52102010,산업용 기계 및 장비
330,1721,Comsys Holdings Corp,52201020,건설 및 엔지니어링
331,6526,Socionext Inc,57101010,반도체
332,5991,NHK Spring Co Ltd,53101020,"자동차, 트럭 및 오토바이 부품"
333,8960,United Urban Investment Corp,60102010,복합부동산 REITs
334,9468,Kadokawa Corp,53302040,소비자 출판
335,4088,Air Water Inc,51101010,상품 화학
336,6923,Stanley Electric Co Ltd,53101020,"자동차, 트럭 및 오토바이 부품"
337,5801,Furukawa Electric Co Ltd,52102030,전기 부품 및 장비
338,3269,Advance Residence Investment Corp,60102030,주거용 REITs
339,8334,Gunma Bank Ltd,55101010,은행
340,1969,Takasago Thermal Engineering Co Ltd,52201020,건설 및 엔지니어링
341,9989,Sundrug Co Ltd,54301010,의약품 소매
342,4967,Kobayashi Pharmaceutical Co Ltd,54201020,개인 생활 필수 용품
343,2229,Calbee Inc,54102020,식품 가공
344,3391,Tsuruha Holdings Inc,54301010,의약품 소매
345,9533,Toho Gas Co Ltd,59102010,천연가스 유틸리티
346,6368,Organo Corp,52203010,환경 서비스 및 장비
347,4922,Kose Corp,54201020,개인 생활 필수 용품
348,5233,Taiheiyo Cement Corp,51202010,건설 자재
349,5393,Nichias Corp,52201020,건설 및 엔지니어링
350,3141,Welcia Holdings Co Ltd,54301010,의약품 소매
351,6141,DMG Mori Co Ltd,52102010,산업용 기계 및 장비
352,6302,Sumitomo Heavy Industries Ltd,52102010,산업용 기계 및 장비
353,8410,Seven Bank Ltd,55101010,은행
354,9301,Mitsubishi Logistics Corp,52407020,항만 운영 및 서비스
355,4613,Kansai Paint Co Ltd,51101010,상품 화학
356,8233,Takashimaya Co Ltd,53402010,백화점
357,8111,Goldwin Inc,53202020,의류 및 액세서리
358,9987,Suzuken Co Ltd,56201040,제약
359,5901,Toyo Seikan Group Holdings Ltd,51302010,용기(종이 제외) 및 포장재
360,9605,Toei Co Ltd,53302030,엔터테인먼트 제작
361,8279,Yaoko Co Ltd,54301020,식품 소매 및 유통
362,9504,Chugoku Electric Power Co Inc,59101010,전력 유틸리티
363,9045,Keihan Holdings Co Ltd,52406020,지상 및 해상 여객 운송
364,3923,Rakus Co Ltd,57201020,소프트웨어
365,4676,Fuji Media Holdings Inc,53302020,방송
366,7240,NOK Corp,53101020,"자동차, 트럭 및 오토바이 부품"
367,1959,Kyudenko Corp,52201020,건설 및 엔지니어링
368,9364,Kamigumi Co Ltd,52405010,"배달, 우편, 항공 화물 및 육상 물류"
369,7867,Tomy Co Ltd,53205010,장난감 및 어린이 제품
370,8418,Yamaguchi Financial Group Inc,55101010,은행
371,8304,Aozora Bank Ltd,55101010,은행
372,4203,Sumitomo Bakelite Co Ltd,51101010,상품 화학
373,3116,Toyota Boshoku Corp,53101020,"자동차, 트럭 및 오토바이 부품"
374,4587,PeptiDream Inc,56202010,생명 공학 및 의학 연구
375,6849,Nihon Kohden Corp,56101010,첨단 의료 장비 및 기술
376,7164,Zenkoku Hosho Co Ltd,55101030,소비자 대출
377,8012,Nagase & Co Ltd,51101010,상품 화학
378,4202,Daicel Corp,51101010,상품 화학
379,5105,Toyo Tire Corp,53101030,타이어 및 고무 제품
380,4540,Tsumura & Co,56201040,제약
381,7988,Nifco Inc,53101020,"자동차, 트럭 및 오토바이 부품"
382,3563,Food & Life Companies Ltd,53301020,레스토랑 및 바
383,4921,Fancl Corp,54201020,개인 생활 필수 용품
384,6473,JTEKT Corp,53101020,"자동차, 트럭 및 오토바이 부품"
385,7518,Net One Systems Co Ltd,57201010,IT 서비스 및 컨설팅
386,4530,Hisamitsu Pharmaceutical Co Inc,56201040,제약
387,1951,EXEO Group Inc,52201020,건설 및 엔지니어링
388,141A,Trial Holdings Inc,53402020,할인점
389,9048,Nagoya Railroad Co Ltd,52406020,지상 및 해상 여객 운송
390,7337,Hirogin Holdings Inc,55101010,은행
391,4902,Konica Minolta Inc,57105010,사무기기
392,7180,Kyushu Financial Group Inc,55101010,은행
393,8985,Japan Hotel Reit Investment Corp,60102040,특수 REITs
394,6856,Horiba Ltd,52102010,산업용 기계 및 장비
395,9006,Keikyu Corp,52406020,지상 및 해상 여객 운송
396,1963,JGC Holdings Corp,52201020,건설 및 엔지니어링
397,8341,77 Bank Ltd,55101010,은행
398,3549,Kusuri No Aoki Holdings Co Ltd,54301010,의약품 소매
399,4812,Dentsu Soken Inc,57201010,IT 서비스 및 컨설팅
400,6323,Rorze Corp,57101020,반도체 장비 및 테스트
401,6770,Alps Alpine Co Ltd,57104010,전자 장비 및 부품
402,8424,Fuyo General Lease Co Ltd,55101050,기업 금융 서비스
403,8114,Descente Ltd,53202020,의류 및 액세서리
404,6471,NSK Ltd,53101020,"자동차, 트럭 및 오토바이 부품"
405,6436,Amano Corp,57105010,사무기기
406,5076,Infroneer Holdings Inc,52201020,건설 및 엔지니어링
407,5214,Nippon Electric Glass Co Ltd,57104010,전자 장비 및 부품
408,8129,Toho Holdings Co Ltd,56201040,제약
409,7984,Kokuyo Co Ltd,52203060,비즈니스 지원 용품
410,8955,Japan Prime Realty Investment Corp,60102020,상업용 REITs
411,7729,Tokyo Seimitsu Co Ltd,57101020,반도체 장비 및 테스트
412,7282,Toyoda Gosei Co Ltd,53101020,"자동차, 트럭 및 오토바이 부품"
413,4205,Zeon Corp,51101010,상품 화학
414,3132,Macnica Holdings Inc,57101010,반도체
415,2222,Kotobuki Spirits Co Ltd,54102020,식품 가공
416,7564,Workman Co Ltd,53403040,의류 및 액세서리 소매
417,4194,Visional Inc,52203030,고용 서비스
418,3471,Mitsui Fudosan Logistics Park Inc,60102020,상업용 REITs
419,1860,Toda Corp,52201020,건설 및 엔지니어링
420,3309,Sekisui House Reit Inc,60102010,복합부동산 REITs
421,4681,Resorttrust Inc,53301010,"호텔, 모텔 및 크루즈 라인"
422,5711,Mitsubishi Materials Corp,51201080,다각적 채굴
423,3048,Bic Camera Inc,53403050,컴퓨터 및 전자 제품 소매
424,4385,Mercari Inc,57201030,온라인 서비스
425,4666,Park24 Co Ltd,52407030,고속도로 및 철도
426,4927,Pola Orbis Holdings Inc,54201020,개인 생활 필수 용품
427,3397,TORIDOLL Holdings Corp,53301020,레스토랑 및 바
428,4631,DIC Corp,51101030,특수 화학제
